"finally dozing off when the sound of the Floo startles me, and when I hear footsteps on the stairs I try to quickly, but carefully, extract my body from underneath my children. I don't want to rouse them, but I'm in no position to protect them like this.

It's only when I hear a soft 'Harry?' in Molly's warm voice, that I fall back and relax.

""In here,"" I softly call out, and only Jamie moves, his eyebrows knitting together in a frown, his little hands briefly clenching.

She appears in the doorway and raises a hand to her heart with a soft smile on her face.

""How's Draco?"" I ask her, and my heart clenches as her smile falls slightly.

""I considered giving him a dreamless-sleep Potion, but ended up doing some meditation exercises with him instead. He's asleep for now.""

""Good."" I close my eyes and run a hand over Lily's soft hair. ""Don't give him any Potions, the Healer said it could set him back.""

Finally managing to shift my children away from me, I sit up and scoop Scorpius up in my arms.

""Here,"" Molly says, holding her arms out to take him. ""I'll take him back to his bed, shall I?""

I nod and I bring Lily back to hers myself, hovering slightly longer than necessary and kissing the top of her head before I go. When I step back into the hallway, Molly is holding a drowsy James.

""Dad?"" he asks.

""G'night, Jamie,"" I say and kiss his cheek before Molly brings him to his own room.

The decision to go to Dray's room is unconscious, but that's where Molly finds me when all three children are fast asleep and tucked in their own beds.

""He's remembering your marriage,"" she says and takes my hand as she sits down next to me on Dray's bed. ""He's having a hard time trying to rhyme his husband with his father figure.

I guess my jaw looks like it's about to drop off my face by the way it's hanging so far beneath its regular pose. I'm gobsmacked. It wasn't the memory of an insane Dark Lord, or a sadistic father, that sent him into a full out panic attack. No, it was me, or rather his memory of me.

Isn't this what I've been trying to avoid the past few years by having him call me Harry? By forcing him to not see me as his father?

""It's understandable, honey. He'll come around when he's able to get everything into perspective. You've found each other against all odds, you'll manage to find each other again.""

I burry my face in her shoulder when she wraps her arms around me. I can't help the tears escaping my eyes, though I try my very best. It hurts. It hurts so much. It's like the tight band that's been around my chest for the past few years is only getting tighter, making it harder and harder to breathe.

Because Draco is my air, I can't be without him. I can't lose him, not now, not after all we've been through trying to get him back.

It's the doubts that hurt the most. I can hear what Molly's saying, that he'll be back when his memories are fully returned, but I can't help but feel that nothing ever really went my way. I've always had to pay a high price for my happiness, and I've been waiting for the hammer to fall ever since Draco and I got married. With having James, Lils and Scorp, Draco's accident just hasn't been enough to tip the balance.

But that's my fear talking, the fear of ending up alone. I can't let that fear strike me down. Gryffindors are brave, they fight their fears and stand strong in the face of defeat. So I do the only thing I can think of and pull back from that comforting hug and dry my tears.

""Yes, we will. I'm not going to give up on us, not ever.""

Molly pats my cheek and smiles encouragingly. ""There's my Harry,"" she says, and pats my cheek some more. Her smile is forced though. She's worried about him. About us.

""Try and get some sleep, honey, you'll need it. I hope you realize what you are in for, giving Blaise and Ginny carte blanche on the party?""

I groan when I remember their wedding. Their grand, two-day-wedding. The one that had all the guests needing a honeymoon to recover from. With Blaise and his Italian traditions, and Ginny as the family's Benjamin, not wanting to be outdone by her elder siblings. They"
". He considered it most seriously until he was down to his skin. ""I do enjoy doing as you tell me. Sometimes.""

""Then you should close your eyes, Draco."" Severus stepped in closer, finally undressing. Finally, because Draco was always nervous if Severus stayed fully clothed. It might mean unpleasant things, although he supposed that unpleasant things could happen just as well with him naked.

Carefully, he curled himself onto the bed, casting a smile before he shifted pillows, settling himself comfortably before closing his eyes and leaning back to wait as patiently as he could manage.

It didn't take long. He heard the tray move, felt Severus settle at his side, seated beside Draco. ""Sometimes, I tire of sitting across from you at the table at dinner.""

""Well, now you are sitting across from me in bed. I expect this is a great deal more enjoyable. At least I think so."" Yes, and then some.

He felt fingers, no, a thumb, linger across his cheek. ""It is. Even if you're insisting on being a brat about it.""

Turning his head to the side, he caught it, sucked it into his mouth. There was salt there, and sweet, and he had no idea what else.  Delicious, and he hummed, finally pulling away again. ""You love me best when I am."" There was no doubt in his mind about that.

He felt Severus shift in a little closer, even as he pulled his thumb away. ""I can't agree with that, or you'll use it against me worse than you already do,"" Severus noted lightly. ""Take a sip of this.""

The cool rim of a glass pressed against his lower lip and he opened his mouth carefully. The warm slide of something crossed his tongue, apple and spice and something with a surprising little shock of a bite. It made him hum and want to open his eyes, but he managed somehow to keep them closed. He swallowed and then sighed. ""Nice.""

The glass was lifted back, and he could hear Severus taking a small sip of the same. ""It's a tea, steeped in cider. I'm becoming rather fond of it.""

Of course he was. Severus loved things with a taste to them, something that had a presence. Just thinking about it made him smile. ""I'm rather fond of you."" And feeling much more patient at the moment, besides.

The taste lingered at the sides of his mouth, the edges of his jaw, tart and tang and spice still filtering through his senses. ""Ha ha, flattery won't get you any more or any less food.""

He couldn't help laughing. ""You still won't let me starve.""

""Never."" He felt faint movement on the bed, and then the announcement, ""Appetizer first. Let me know when you need more to drink.""

Opening his mouth, Draco waited patiently. He managed not to smile, which was quite difficult. ""You know I have nothing against declaring when I want something.""

""The least of your problems."" He felt a touch to the edge of his mouth, another morsel of food against his lips. It felt round, smelled crisp, and the first taste was sweet coated in a fine film of salt. Apple, and he loved apples, the contrast of salt and fruit on his tongue making him shiver and hum. Good, unexpectedly so, and he chewed slowly, licking his lower lip when he was done.

Simple, stupidly simple after the tea and apple cider that was stupidly simple as well, but so tasty. Just a contrast of flavors, lingering against his tongue long after he'd swallowed. ""What do you think of that?""

One more time, he ran his tongue over his lower lip, then reached up and rubbed a thumb along the edge of his mouth. ""Delicious."" Unsurprising, really. Severus, for all his stern and unbending appearance, was a master of sensual delights. It was the little things, really; things like salted apples and who knew what would come next.

The next sensation against his lip was also firm and round, but he could smell the tang of balsamic, and maybe it was tomatoes. He wasn't sure until he bit down, the burst of cherry tomato on his tongue accompanied by the faint pop of the skin bursting, and oh. Oh, that was very nice indeed, made him want to open his eyes to see what came next. He swallowed before he spoke. ""My curiosity is becoming a bit.. overwhelming.""

""I don't want you to get bored. You might not be able to guess the next one, though."" And it wasn't immediately there. There was a lingering stroke of hand against his stomach, fingertips trailing lightly against skin.

""Should I be guessing?"" He couldn't help shifting. The touch was simple, just like the things he had been fed, but it was perhaps all the more arousing because of it"
"tingling sensation at his spine. “So what stopped you?” he asked defiantly.

Lucius sighed. “What good would it do me, if I cannot go beyond the wards of this hovel? Your little friends would take one look at your dead body and lynch me before the Aurors could arrive.”

“You tested the wards,” Harry said flatly. “And I’m only alive because you couldn’t break them.”

He saw Lucius’s eyes darken as he lowered his head slightly and curled up his upper lip.

“Could you even blame me? Leopards don’t change their spots, Potter, it is you who should have been more careful. But no harm done, you were once again lucky.”

Harry shook his head, turned on his heels and left the kitchen. He wasn’t hungry anymore.

He couldn’t let Lucius win though, not if he wanted to maintain the status quo. He was master of this house. He’d be the one who made the rules. Only he would decide what was and was not acceptable behaviour.

When Lucius had asked for clothes the night before, Harry had briefly considered buying him a new wardrobe in Diagon Alley. It would even be the quality clothing befitting a Malfoy, a sort of ‘thank you’ for his gentle treatment during the bonding.

Harry rushed up the stairs for the fourth floor. He’d stripped and changed almost the entire house over the summer, but he’d left the top floor the way it had been when Sirius was alive. The one door still read SIRIUS, but it was the other door he pushed open.

Kreacher had taken almost everything in his despair, holding on to his dead master’s favourite items. Luckily he’d left Regulus’s wardrobe alone, and it was filled with soft silks and rich cottons. The designs were dated and the colours faded by time, but high quality nonetheless.

Harry folded enough of them into a rough pile to last a week, and stuffed them under his left arm. He was not going to let himself be lulled into a false sense of security again. Lucius was a Slytherin, and he had years of experience over Harry.

He held onto the railing as he rushed downstairs, sliding down the last two steps, almost falling flat on his ass.

Lucius wasn’t on the third floor, so he quickly dropped the pile of second hand clothes on the bed in the smallest bedroom, and retreated to his own room on the first floor. Maybe space and time wasn’t what he needed. Maybe he just needed to pick up his life where it had left off before Malfoy.



 




Lucius stayed out of his way as requested. He only showed up for dinner, after which he grudgingly took up a scrub sponge. They didn’t really speak at the dinner table, apart from Harry’s polite ‘good evenings’. At least, not until Saturday.

“Potter,” Lucius said. “I’d like to be permitted to use the Black Library.”

Harry looked up from his meat and two veg, only to see the unreadable expression Lucius always wore on his face.

“Uhm, no,” he replied and took another bite of carrots.

“I will not spend my days in my room, waiting for one to blend into another, boy. I have read that book on Magical arts and crafts seven times already. And let us not even mention the fact that I have no interest in crocheting Charms to start with,” Lucius couldn’t hold back the indignation from showing through his iron mask.

Harry smiled to himself. So that was what that book had been about.

“That’s all very well, but I’m not allowing you into a library that’s filled with a million ways to cause mayhem without a wand,” Harry replied, staring into the distance for a minute, his fingers resting on his bottom lip. “I will pick some books for you to read.”

“Magnificent,” Lucius muttered. “How I look forward to sampling your literary palette.”

“I do promise there will be no books on magical knitting or embroidery.”

The glare Lucius shot at Harry only made him chuckle lightly.



 




He owled Draco.

The reply was a rather large package, heavy too, if the way the black owl was struggling with it was any indication.

When Harry opened it, it proved to be a small stack of books on topics varying between English Poetry, Scottish Deerhounds and Rose-Breeding.

It came with a short note:

“I’ll be over for tea at three.”

Harry sighed. He’d known that at some point he would be entertaining Draco as a guest. He was worried about how the man would feel about his father shacking up with his former adversary. He was also worried that the two Malfoys together would prove more than he could handle.

Harry wasn’t entirely sure why, but he didn’t tell Lucius his son would be over for tea.

Still, when the doorbell rang at three, he called him down into the living room.

“Harry,” Draco said immediately"
"Fuck.

That was all he could think. Fuck, because they had been at it for a while, fuck because Neville, that bastard, had been enjoying teasing him to the absolute and utter last of his ability to bear it.

He had even yelled. At least six times. Demanding, in fact, that he be allowed to come.

""I just want to... enjoy it, you know?"" Slow slide in and slow slide out, barely moving a quarter of an inch at a time. Or worse. He wasn't sure.

Draco couldn't keep himself from yelling again, squirming viciously. ""I've enjoyed it enough, now I want to come!"" 

""I haven't."" Neville eased his dick out again, and Merlin that was impossible. How on a earth was he even still moving? Draco felt like his bones were made of pudding, in sharp contrast to the stone-hard feeling of his cock, and he wanted desperately to make further demands. Wanted to come, and every time he got close, Neville muttered that damnable spell and he wanted to strangle him. Wanted to do a great many things, but there was also a sticking charm on both of his wrists and he couldn't very well reach down and do what he wanted.

The whole point of sticking charms was to keep him from doing anything fun, but it had seemed like a good idea. When they'd started, because now Neville was going to fuck his sanity out of him.

Bastard. ""Bastard, bastard, let me... Aaaahhh!"" Yelling didn't help; if it had, he would have been allowed to come by now.

This. This was what he got for having a relationship with a pureblood Gryffindor. A Mudblood would never consider the sticking charms, Draco was sure of it. Pure bloods knew everything, every spell, even if he'd been suspected as a squib for ages. There was probably a spell that was keeping his dick so fucking hard as well. ""Going to, uhmph, scream it out?""

""Yes!"" Yes, except Neville pulled out again, being deliberate about the way he did it, and Draco couldn't. Couldn't scream or yell, because all he could do was whimper and try to pull him in closer with his boneless legs.

Pulling him in only got him more dick, and Neville laughing slowly as he pulled back with ease. ""Draco, this hurts you more than it hurts me...""

Fucking Merlin. ""Yes, exactly! That is what I've been... nnnnngh."" Saying. What he'd been saying, and it had to end, didn't it? Eventually? Neville would have to let him come, surely.

""Just beg for it, Draco. Just a little begging..."" He leaned in, held still, and Draco just wanted a little more motion and to come

""No, no."" No, he was stronger than that, or he'd thought he was. Quite frankly, his pride was nearly worn down to nothing, and he wanted so badly to come. Wanted, and Draco drew in a deep, shuddering breath and moaned, fitfully. ""Please.""

Please, because he needed to come. Needed it like he needed to breathe, needed it like he needed magic running through his veins. It wasn't something he wanted.

It was something he had to have. It wasn't something he was going to get, he was fairly certain. Not anytime soon. Not until he was begging and desperate and cross-eyed from the endless pleasure.

If it weren't so amazing, he would kill Neville in his sleep. Thank goodness for Neville, it was, and he shifted again, making Draco moan. He thrust, a slow motion, and reached down to stroke at Draco's dick, tightening the spell on him.

It was going to be a very long weekend."
"have used it. Maybe then, some of his friends would have survived the First War…

Voldemort looks at him like he’s grown another head. Oh, yeah, he spaced out a little. Overdosing on magic enhancing potions tended to do that. Got a little high sometimes….

“So are you going to kill me now?” he asks with a smirk. The Dark Lord should be happy enough to acquiesce.

“Should I?” Voldemort drawls and puts away his wand instead. Harry gapes and then, after a moment, realises there is a pressure on his mind. Damn it, he’d forgotten all about using Occlumency – hadn’t needed to in years. Muggles aren’t exactly skilled in the mind arts after all, and who else did he have to hide from when they were all dead?

“Damn,” he breathes, but  within moments, decides that he doesn’t actually care. He’d jumped into the Veil prepared to die. Whatever happened now… wouldn’t change anything.

Voldemort takes several moments to look him over. Harry can feel the magic crackling around them and marvels at the feeling or wholeness it brings him. He even marvels at how he’d been stupid enough not to notice it until it was far too late. They could have done such great things together…

The Dark Lord paces around Harry, who is still sprawled out on the floor lazily. He’s watching him carefully, intimately and calculatingly. Every step, something new is decided and Harry knows the fate of this world, of a different future, is decided.

“This isn’t the first time you’ve been here,” Voldemort murmurs, fascinated. Harry just blinks up at the man uncomprehendingly.

“Magic is… timeless,” Voldemort says, sensing his curiosity. Harry’s mind is wide open, though he doesn’t have the strength or the motivation to shield it either way. “It always leaves traces. No matter how much the timeline has been distorted, there will always be traces.

“You’ve been here before, in a different past and a different future. Your indecision and inability to do what is necessary have always brought you back right… here.”

Harry mulls this over in his head for several moments. Really, he just feels tired. He’s had the fate of the world on his shoulders for what feels an eternity, but now he really doesn’t give a flying fuck. He’d tried saving the Muggles, but they’d destroyed themselves and the world around them in the process. Like cancer, they’d spread and burned through every last spark of good in the world until life everywhere had been extinguished. The Wizards weren’t much better. They were selfish and overconfident. They’d spurned the Muggles into action, driving and feeding the flames of their fear. No matter what he’d do, no matter how hard Harry would try…

“Harry, look at me,” Voldemort commands, almost kneeling in front of him. The cool, crimson eyes are a familiar, soothing sight for Harry’s confused, tired mind. “There is another way.”

There is a silence.

“Remember, under the dungeons of Hogwarts, I told you that together we could accomplish anything?” Harry nods numbly, trying to push away the pain these thoughts bring him. Ron, Hermione, Ginny… they all died, torn apart by Muggle weapons. “I did not lie to you. You can still change the future, avoid the inevitable and carve your own path…”

It’s terrifyingly charismatic and Harry wants to believe him. He wants this sliver of hope to hang on to, but it’s too good to be true. He’s scared of losing everything again. Years of fighting and losing had turned him into a wreck, a coward and a liar. If only Dumbledore could see him now!

Voldemort is calm, collected, compelling. The speech sounds almost rehearsed and Harry feels the drop in his gut when he realises that it’s probably because he has said it many times before. How many times? How many times had Harry chosen to condemn the world due to his own unreasonable apprehension to the man who had taken so much from him? The thought makes him shudder. He used to hate Voldemort… no, he thought he had. Hate, strong and consuming, had been unknown to him all those years, until he saw Wizards stripped of their powers, burned from the inside out by their own bodies, unable to cope. He had hated Muggles then. Voldemort’s coldblooded, although relatively humane by comparison, murder of his parents had faded in his mind. He had not known his parents. Ron, Hermione, Ginny, Luna, Neville, countless others… he’d known them and seen their last, suffering moments as they begged for mercy.

If he had a chance, however slim, to prevent the slaughter of the people he loved…. He would… Harry strangled the thought right there. He told himself, it would all be over now. He"
