"a lot of shit, right? Like, students doing lots of stuff, saying things, trying stuff out, um… experimenting and stuff?” You nod, wondering where on Earth this is going. It almost feels like Malfoy is about to come out to you, which wouldn’t exactly be a surprise, except for why on Earth he would be telling this to you of all people. “So my so… my… my child, Scorpius, came to me today to… talk about something. And…” Malfoy sighs, finishes his beer, and motions for another. You do so, but switch to the lighter (and amusingly named) Kelpie Spit - after all, once you’ve reeled them in, you don’t want them passing out before finishing the story.

He takes a sip and continues. “Have you… have you ever had a wizard come to class, and then the next day, they’re a witch?”

This is not at all what you expected. “You mean, like with a polyjuice potion?” you ask.

“No, not like that,” Malfoy says irritatedly. “I mean -”

“Well, I have heard that stewing and ingesting horklumps during an eclipse on a rainy dew while wearing a particular shade of chartreuse can cause a variety of amusing effects, including a brief reversal of genders -”

“I’m not bloody talking about pickled horklumps!” he spits, making you glad you started him on the lighter stuff. “Stewed,” you mutter under your breath.

“I mean, the wizard shows up to class the next day and he looks pretty much the same, but he says he’s a witch now?”

Ohhhhhhhh. Now you get it. You must say, your experience in such matters is minimal, though a pleasant but not particularly applied (at least in Herbology - Ancient Runes was apparently a different story entirely) Ravenclaw student in h… his fourth year at Hogwarts started asking to be called simply “Alex” instead of “Alexis”. You didn’t think much of it, but you did notice he- him, wearing more male-oriented clothing (though with Hogwarts dress code it’s not like there’s too much of a difference - he’d never been one to wear skirts anyway), and overheard Madame Pomfrey muttering on about cooking up an usual type of potion for Alex (though Madame Pomfrey did a lot of muttering these days, and usually of the not entirely coherent variety). You tend to let your students be students and just focus on their school work unless they come up to you - and while you’ve mentored many a student in your relatively short but varied time as a teacher at Hogwarts, Ravenclaws have been the most reticent to ask for your advice - even more so than the Slytherins! It probably has something to do with your rather convuluted way of explaining some thi- oh shit Malfoy’s talking again.

“Like, I could understand being into wizards. It’s the 21st century. It’s… it’s a new era. Look at me - I’m, I’m a changed man. I don’t…” he pauses, hiccuping slightly, stares confusedly at his hands for a brief moment, and then continues. Yeeaaah, probably just gonna give him water from this point forward. “I don’t call muggleborns mudbloods any more. I don’t. I promise. And like, we’ve all thought about it. No wizard hasn’t. If they say they hasn’t, haven’t, they’re a liar. And not a cool one like me. A... a, whatchamacalit. A dumb one. I mean, we’ve ALL been there, in the showers after a quidditch match, and you jusht HAPPEN to look over and you know maybe you don’t hate what you see!” Malfoy’s hands are really getting into it now, and he’s starting to draw attention from the few remaining bar patrons.

You do your best to hide a snicker - Ron is gonna love this story (on second thought, he might love it too much - maybe you should keep this one to yourself), and Malfoy manages to somehow combine a scowl and a blush into a single gesture. “The point is, I could understand if he, you know, flew for the other team. But this… I mean, I’m obviously not mad or anything, I just… I - I don’t have any, wazzit called, any rame of feference, any fame of deference, any, any… I just don’t quite get it.” He take another drink, and continues, fortunately with slightly less exaggerated hand motions. “Was I… am I… a bad father? Did I do something wrong? Why’s… why’s my beautiful boy got it in his head that he’s a witch?”

Hoo boy. There it is. You… you’re going to be honest, you really have no idea how to respond. Brief encounters with Alex notwithstanding,"
"I know every word in the books which line the walls in my room. Everyone else in this place wonders why I wear my torn up trousers for the fifth year in a row – my ankles are showing, too – and instead of asking for new ones, I ask for a book every time the matron manages to spare some money for us orphans. It’s because they’re stupid and don’t understand the true value of the printed word. No matter, they will come to regret those choices one day. They seem to think that the orphanage will always be there to provide what little there is for them. I know what the world out there is like. Homeless men die on the streets every night. Homeless women whore themselves out to anybody willing. That’s just how it is, but I have no intention of following this cursed pattern. I might have nothing to truly call my own – except for my body and mind, but that is enough.


It will be enough for me to show them all my superiority. I will climb this rotting, broken ladder of society and find a better place for myself. 


I have a sharp mind, an agile body and good looks – that is plenty of proof. I belong above this pile of maggots who eat each other for a few scraps of material. It’s all here; in my head.

Long hallways and many, many doors hold my knowledge. There is still plenty of space; I know my mind has no limits. There are colourful books here and a warm fire which comforts me whenever I’m exhausted after using my powers to keep those fools in line. There is also a small picture frame on the impressive mantelpiece in which I can see a moving, ever changing image as crisp and bring as the real world. It shows a boy around my own age, with bright green eyes full of sorrow and a mop of unruly black hair. His forehead bears the strangest scar I have ever seen, in the shape of a lightning bolt. It strangely warms me to see it etched onto his pale skin so clearly.

He’s thinner than even me and his clothes are almost as bad. He’s made to do chores after his family has gone to sleep and isn’t given food for weeks at a time.

His world looks so much different than mine. There are many strange machines which I have not seen before there and sometimes I wonder if what I can see the future. I don’t let it bother me though. I will find my answer sooner or later, as I always do.

For now, I will settle for watching the green-eyed boy as he curls up to sleep on the broken bed in the cupboard under the stairs. He’s so peaceful when he dreams – a small smile appears on his lips as he whispers something I cannot hear. Wishfully, I imagine his lips forming my name silently.

Maybe I could meet him one day and make him say it and claim him as mine.

Such an imbecilic thought. With that, I leave the luxurious chambers of my mind and settle back into bed, with a fantasy book about time travel and magic tightly gripped in my hand.


Later that night, I dream of him again. 
"
"
It wasn't always like this, wasn't hurtful, wasn't a mess. It use to be fun to be around his father, every day a wonderful story, used to be safe at home. But After his mother died it became a living hell, his father a ticking time bomb. No matter how hard Theo tried to stay out of trouble His father would still beat him, he would still be scarred. He would Beat him Senselessly, would laugh as Theo Pleaded for him to stop, would jeer when Theo was nothing more then a pile of broken skin and bones, was a broken bird shaking in a pool of his own blood. His father would then leave, not to Get Towels to get the blood off and apologize. It was never that, it was always Him getting scissors, in which he would chop of Feather after feather off of Theo Beautiful Grey wings. Only atfer would theo Be able to get up, To stumble to the bathroom on shaking legs. Where He would Clean himself off with tears pouring down his Pale face, where he Would Look in the mirror and stare at his wings, he then would to his bedroom and lock the door. Then he would collapse into his bed with his thin sheets and Shake the whole bed with his sobs. His father used to be some what nice when his mother was alive, They still have pictures of Him and His father hugging with big smiles on their faces. Those days were now forgotten, only memories locked away. But after the death of his wife His father succumbed to the darkness that lies inside of everyone, and the only way to Push it back was to hurt his only son, but the darkness came back. It always came back. So he cut he wings and made sure His bird wouldn't fly away. He kept him caged while other birds Flew away. But No matter what Theo never gave up, He didn't bother to fly atfer all his wings Couldn't hold him. But he never did hate his father, he understood what he had to do So his father wouldn't go crazy. So he suffered, suffered while his friends flew away, suffered when his father beat him, cut his wings, suffered when he Would plead to god- to his mother- to save him, but no one did. Theo wings were the only thing that helped him remember his mother, his wings were her's in a way. But when they were cut his mother started to fly away, to vanish. Theo would reach for her crying, but no matter how hard he reached for her she still Flew away. Leaving him alone in this hell. So he suffered, the person he used to be was gone, he vanished when his mother died and left him alone. He didn't want to be alone as Selfish as it was- he wished It was different. He longed for The old days. He started to give up, atfer all he was a boy with broken wings. Then he met The love of his life who didn't care about his wings, didn't care that he was broken. They fell in love slowly, Like snow falling on the ground. They shared their first kiss under a tree in they shade, they lost Their innocence on Christmas Eve. He didn't care that Theo was damaged. He loved him for all his flaws. A boy with damaged wings found Comfort in the boy Who Had a bad past. They didn't care about the bad things, they only loved each other. Never fought never Yelled. A boy with damaged wings started to Fly with the help of Blaise
"
"Hermione slammed her heavy satchel down on the bed, scattering schoolbooks and rumpling the freshly pressed sheets.  How could she just leave like that?  They had the whole afternoon planned.  She knew how much time Hermione had put into revising for her NEWTS, she knew they needed to spend some time alone, lost in thoughts of only each other, but she had gone anyway leaving Hermione alone with only her books again.

Damn Ron for needing to talk to her NOW!  Hermione wondered what kind of Weasley emergency he had conjured up this time.  Ron was having a difficult time with his sister’s sudden interest in his best friend, and he would stoop to almost any length to keep them from spending any time alone.  Hermione was beginning to get quite annoyed, but Ginny hadn’t even seemed to notice.

“Mum’s having a crisis over Fred and George’s latest antics Hermione, I have to go this time,"" Ginny had pleaded as she sat across from her girlfriend in the library.  “I can’t always leave Ron to deal with it, especially where Mum is concerned.""

Hermione pushed the books off the bed onto the floor as she remembered the conversation.  She didn’t usually treat her things so poorly, but right this minute she was not in the mood to be tidy.  Running her fingers through her wild curls, she sighed and lay back onto her soft pillow.  The sun shone through the window of the Gryffindor dormitory reminding her of the picnic they had planned by the forbidden forest. 

Her eyes fluttered closed and she smiled at the thought of Ginny laying beside her on one of Mrs. Weasley’s handmade patchwork quilts and she couldn’t stay angry with her.  The wind would tousle her soft red hair, the sun making her freckles even more prominent.  A soft sigh escaped Hermione’s lips as she imagined their tentative kisses and hesitant touches.    Everything still felt a little new to them, their relationship barely four weeks old, and both girls still marveled how those light caresses, and softly mumbled sentiments could quicken their heartbeats and leave them breathless so fast.

Without realizing it, Hermione’s hand had left her side and moved lightly across the front of her jumper causing her to jerk slightly as it brushed her nipple.  Warmth rushed through her body as she remembered the red haired girl’s feather soft fingers in the same place.  Her body’s reaction surprised her a little, but not enough to make her move her hand away. 

Ginny often took the lead in their lovemaking, and Hermione was happy to let the younger girl control things a little.  She thought about that now as she could almost feel Ginny’s silky tongue circling her obviously erect nipples, causing her to moan softly and her breath to quicken. 

Almost on their own accord, her fingers traveled slowly down to the waistband of her skirt as the heat of her body became more intense and she could feel the wetness begin to build between her thighs.  “Mmmm Ginny,"" she mumbled as her hand moved under her skirt and brushed just lightly over her cotton pants.  She could feel the dampness there and it surprised and excited her.

Hermione imagined Ginny’s long fingers lazily pulling back the soft material and sliding quickly inside.  Her own hand mimicked her thoughts, and the touch caused a jolt of raw feeling to pulse through the young girl’s body.  Giving no thought to the fact that someone could come strolling in at any moment; Hermione began to slowly rub her fingers over the now firm nub between her legs. 

She gasped as the wetness spread around her fingers and one slid inside her, causing her to lift her hips to meet the palm of her hand.  Her breathing had become ragged and her head felt foggy, but yet her body was reacting beyond her control.  She knew her climax was not far off, and she started a rhythm with her fingers and her hips that she knew would bring her there faster. 

Suddenly she was aware of hurried breathing in the room that wasn’t her own.  Was someone there?  A moment of panic washed over Hermione as she realized she was being watched, and that she was too close to orgasm to stop what she was doing.  Her eyes opened slowly, and she glanced over to the doorway of the girl’s dormitory.  What she saw made her breath catch in her throat, and her muscles contract around her fingers, bringing her to immediate climax. 

Ginny Weasley leaned against the doorway and moaned softly as her own passion overcame her, moving her fingers quickly under her grey skirt and keeping her eyes fixed directly on Hermione’s gaze.  Neither girl could break eye contact as together their breathing began to slowly regain its usual rhythm.

“I’m guessing you missed me,"" Ginny said softly, a silly grin widening across her rosy freckled face."
"They say that sometimes our dreams come true in the most unexpected ways.

The corners of Harry’s lips turned up slightly, going unnoticed by anyone in the ever shifting swarm of people surrounding him. It was a noisy, busy and in general absolutely insufferable gathering and Harry’s brow slicked over with cold sweat at the thought of having to endure talking to all those pretentious witches and wizards who came here to gawk at him.

Instinctively, he sought out the comforting crimson gaze of his husband. Making contact from all the way across the hall full of people, he instantly felt better and steeled himself for the many more hours he’d have to spend in the stuffy, overly populated room.

Now, many things could be said about his husband. That he was a madman, a cruel and ferocious being who cared nothing for the people around him. Maybe that he was an orphan of a cursed bloodline with too much power to be healthy. None of those things mattered though, because – honestly – people could think and talk whatever the hell they wanted and it wouldn’t make any of those things true.

The papers said the marriage had been forced and entirely a political affair.

Harry would beg to differ, but didn’t have the energy to battle the press yet again. His life was far too involved with the Prophet already and if he saw Rita Skeeter again in this lifetime it would be too soon. What he knew and felt in his heart was all that mattered. The golden band around his finger was testimony enough to that, because he could swear to Merlin and Morgana themselves that he’d never get roped into an arranged marriage. Everyone should know well enough that he never followed the rules anyway. He was notorious for butting heads with the Minister for it, but generally came out on top thanks to his popularity and the fact that Fugde was desperate to remain in office and would rather not tempt Harry to try to become the youngest Minister for Magic in history.

No, the political benefits of the union between the heirs of Gryffindor and Slytherin aside, Harry really was in love with Voldemort. It was funny, because a year ago he’d run to the ends of the Earth from an unexpected marriage. Things had changed so suddenly he’d never even noticed when he fell head over heels for the strange, yet enticing Lord of the House of Slytherin. They’d argued over a bill for the protection for Muggleborns out in the Muggle world, sending chairs and people flying with the intensity of their magic clashing as they traded honey-coated insults back and forth. And then, quite uncontrollably, they collided with all the strength of their emotions – lips and hands and bodies coming together all on their own. It had been a violent beginning of something beautiful.

The bill for protecting Muggleborns was revised so many times Harry wanted nothing to do with it ever again, but due to their joint effort, it was fair to both Purebloods and  Muggleborns and, most importantly, protected those who needed it the most. Harry just knew then, that there was more to Voldemort than a man who only looked out for himself. He was self-absorbed and had some serious anger management issues, Harry will forever be the first to admit, but there was something about him that just caught his heart and never let it go.

Now, still reeling from the excitement of the ceremony, Harry couldn’t be happier. His husband – notoriously handsome as always – was giving him a secret smirk from across the hall. It just promised all sorts of pleasurable torture which he would thoroughly exercise on Harry later that night. A little shiver ran down Harry’s spine at the feel of the intense crimson gaze as he tried and failed to suppress a grin from stretching his lips in response.

No one else would know. They could say whatever they wanted, but Harry felt untouchable with Voldemort at his side. He was the luckiest man alive and no amount of pitying stares from strangers surrounding him could change that. Maybe one day they’d see what they’d been missing all along. Maybe not, but either way Harry knew he’d be happy. Taking Voldemort’s skinny, cold hand which gripped his tightly, he felt stronger than ever. Ready to take on the world.

… but first, he could lean in and steal a long, well-deserved kiss off his beloved’s lips.  "
"with Smithly. Harry made sure to head home before Draco would come to pick up his son, and spent the night brooding alone at home.

 



 




The following weeks were quite busy for Harry. A group of young vampires was causing trouble in Knockturn Alley, and he had to supervise an Auror guard to keep the streets in and around Diagon safe for both the customers and the shopkeepers.

The combination of long days and restless nights was breaking him up, and when they finally caught the culprits red-handed, Harry was tired and unfocused.

It was stupid, really. He’d known from witness statements that the group was made up of five vampires, so he also should’ve known they weren’t finished when they bound four of them. Still, it didn’t occur to him until a pair of sharp teeth dug into his neck.

The little bugger was petrified by one of the other Aurors, but not before he’d drained a good portion of Harry’s blood.

He was lightheaded and staggered a little. Smithly was next to him in a flash, and pulled Harry’s arm over his shoulder, yelling at their colleagues that he was going to take Harry to St Mungo’s.

“Fuck, no,” he moaned. “Stop fretting, I’m fine. Nothing a good night’s sleep won’t fix.”

“But Harry,” Smithly whined, “you should see a Healer. I’ll take you, it’ll be alright.”

Harry pulled back his arm and pushed his partner away. “You’re not taking me anywhere. I’m going home. Tell Robards I’m taking a few personal days.”

He Apparated home and slumped on his couch. He would sit there for a little while, gathering the strength to drag himself upstairs to his bed.

 



 




The sound of the doorbell roughly pulled Harry from a most wonderful dream. He’d been in bed with Draco’s strong hands softly caressing his back, as a mouth traced light kisses over his shoulder and down his arm.

Harry blinked and looked around him, only to realise he’d fallen asleep on the couch, alone, in his Auror robes.

The doorbell rang again.

“Fuck,” Harry swore under his breath, but stood and made his way to the door anyway.

“Oh, thank God, you’re here,” Hermione said, as he opened the door and she rushed past him. “We need to talk.”

Harry slowly closed the front door and turned to face her. “Good evening, Hermione. How lovely to see you. Why don’t you come in,” he said dryly, and followed her to the living room.

“What on earth did you do to your neck?” Hermione asked, when he slumped back down on the couch.

Harry opened his mouth to reply, but she immediately cut him off.

“Never mind, it can wait. What do you know about Veela?”

She looked at him intently as he ran his hand through his hair. “Er, they’re beautiful and they have wings sometimes? Fleur is a Veela, isn’t she?”

“Fleur is only part Veela, but it doesn’t matter. A Veela is a being by the Classification Act of 1811. They are close to human physiology, but not completely the same. They mate for life. Once they do, they’re impotent to anyone else,” she said and kicked Harry’s leg. “Don’t you fall asleep, Harry! This is important!”

“Sorry, Hermione, but you burst into my house like there’s a bloody fire going on,” he replied, feeling rather irritated. “And then you go on about some useless trivia about Veela. Will you get to the point?”

“Draco’s a Veela.”

Harry cleared his head with a little shake and considered her words. “Er, no.”

“He is,” Hermione replied. “Hetty Ballard of the Being Division called in sick today, so I was filling in for her when the Aurors called for the registration papers for the vampires you caught this morning. It was when I was searching for Jenz Malfurion’s papers my eye caught the name Malfoy. Draco’s a Veela, Harry, and so was his father.”

He frowned. “I’m sorry to be crude, but Draco can’t be a Veela. He was most definitely not impotent when I fucked him, and he sure as hell fucked around on me enough to impregnate Scorpius’s mother. Unless you’re trying to tell me the boy is not his son.”

“No, what I’m trying to tell you is Draco is Scorpius’s mother, for all intents and purposes!”

Rubbing the palms of his hands over his eyes, Harry tried to process what Hermione was saying. Draco was a man, most definitely. Men didn’t get pregnant. Though, hadn’t she said something about near human physiology? Could male Veela get pregnant? Was that what she was telling him? But did that mean Draco"
