"retirée. Ensuite, une vieille femme les relevèrent en les tenant chacune par une main.

« Grande winkte, tu as désormais une épouse », lui affirma-t-elle en regardant Rahne dans les yeux.

Même si elle comprenait le langage amérindien, le terme employé par la vieillarde pour la désigner lui restait inconnu. Peut-être que Dani, qui parlait couramment cette langue, saurait de quoi il était question ? 

Le sentiment de bizarrerie onirique la reprit. Mirage était donc devenue sa femme ? Elle avait certes fait quelques rêves étranges qui mettaient en scène son amie et elle, mais ils ne s’étaient jamais montrés aussi définitifs. Le rouge lui monta toutefois aux joues à ce souvenir. 

« Ne sois pas gênée, ô winkte, reprit la vieille, en se méprenant sur les causes de son rougissement. Il est normal pour un être à deux natures tel que toi que d’avoir une épouse. »

Elle éleva les bras, ce qui eut pour effet de leur faire lever l’une de leurs mains, celle que la doyenne tenait.

 « He’évo’nehe et Neneske sont désormais mariées ! Célébrez l’union de la Louve et de Mirage ! »

Un concert de hululements répondit à cette proclamation. Tout le village semblait très enthousiaste à cette idée.

« Maintenant, dansons ! » déclara encore la vieille femme.

Comme souvent dans les rêves, Rahne avait à peine conscience de ce qu’elle faisait. Tout lui semblait aller de soi. Au son des tambours, elle se mit à tournoyer autour du feu pyramidal, sous les étoiles. Les extrémités du bandeau de tête qui avait été fixé à son front par des liens au niveau des tempes flottaient librement, et accompagnaient gracieusement ses mouvements. Dani évoluait à ses côtés. Leurs gestes se répondaient sans cesse, dans un cercle harmonieux. 

Et lorsque leurs lèvres se joignirent, ce ne fut qu’une nouvelle manière de continuer la danse. Leurs corps se reconnurent et bougèrent eux aussi en fonction de la musique envoûtante, du rythme propice à la transe. Des mains fiévreuses se cherchèrent, se touchèrent.

« Nous sommes ensemble, à présent », souffla Dani à l’oreille de sa compagne, avant de l’embrasser de nouveau.


*


Doug aussi rêva d’une couverture blanche, puis d’une danse. L’homme qui avait organisé la cérémonie les avaient appelé « Éehaseo'o » et « Nésôhome », ce qui signifiait « Roche aiguë » et « Cypher ».

Ils s’étaient couchés dans le même tipi. Hésitant, Warlock lui avait demandé :

« Est-ce que self doit faire quelque chose en particulier ? »

Il sentit ses joues s’embraser à cette question, mais tenta de répondre selon ce qu’il ressentait – à savoir une immense vague de tendresse pour celui qui, d’après le songe, était devenu son époux.

« Rien de particulier, expliqua-t-il le plus honnêtement possible. Cela ne dépend que de nous. » 

Un certain temps de réflexion silencieuse suivit cette déclaration. À tâtons, Doug se rapprocha de l’alien et lui caressa la joue. Il savait que ce corps n’était qu’une apparence, mais ce simple contact l’emplit de frissons de plaisir. Puis il l’embrassa, très doucement.

Une fois encore, ces lèvres étaient imaginaires, mais tout n’était qu’un rêve, de toute manière. Il avait l’impression d’être plus libre, empli de cette assurance que l’on éprouve dans les songes, quand on sait qu’il suffit de le décider pour se mettre à voler dans les airs.

Lui, il avait décidé d’admettre ce qu’il ressentait pour Warlock, et c’était tout aussi important. 

« J’aimerais que tu me serres dans tes bras », avoua-t-il ensuite. L’extraterrestre s’exécuta. Ils se caressèrent longtemps avant de trouver le sommeil et s’endormirent ainsi, enlacés. 

Une fois de plus, Doug réalisa un rêve à l’intérieur d’un autre rêve.

Il marchait paisiblement dans le village. Soudain, un groupe formé de trois jeunes Indiens se moquaient de lui en le traitant d’homme-femme. Doug fronça les sourcils. Personne n’avait eu l’air de railler ou de s’opposer à leur union de la veille, et il ne comprenait pas le pourquoi de ces moqueries. Il décida donc d’y réagir. 

« Pourquoi vous moquez-vous de moi ? les apostropha-t-il. Je suis l’époux de l’heemaneh, vous me devez le respect. -Self-soulfriendDoug est lié à self », approuva Warlock derrière lui. 

Rassurant, il posa la main sur son épaule. Par réflexe, Doug posa sa propre main sur la sienne. Les trois jeunes hommes s’arrêtèrent immédiatement de rire et s’inclinèrent vers lui, plein de révérence.

« Ô heemaneh, vous, vous méritez le respect, murmura le premier. Vous pouvez revêtir toutes les formes. Vous savez entrer en communication avec l’autre monde, et aussi soigner les guerriers blessés.-Celui qui partage votre vie ne détient pas tous ces talents, reprit le",candidate00008
"Démétra les croisa dans le couloir avec un gracieux « Messires », accompagné d’une révérence. Après son passage, Hervé de Rinel demanda de son ton lunaire habituel :

« Hey, mais ça serait pas la femme du chevalier Bistreval, elle ? Euh… Berlewen ?-Aucune idée, avoua Perceval. Moi, les filles d’ici, je les confonds toutes.-Ho bah pas vot’ p’tite Angharad, quand même… le taquina Karadoc. Elle vous aime bien, en plus.-Ouais, elle okay… mais alors par contre, elle se vexe hyper facilement ! C’est pas ma faute si le baiser romain, moi, je trouve ça dégueu.-J’suis bien de votre avis », acquiesça Karadoc.

*

L’habituel fond sonore, aux tonalités perçantes et ringardes, résonnait dans l’auberge, tandis que Perceval et Karadoc attendaient patiemment leurs consommations, à la même table que d’ordinaire.

« Chevalier, j’ai l’impression que c’est pas évident pour jouer les jolis cœurs! commença le Tavernier, en posant leurs choppes sur la table.-C’est pas faux ! répondirent presque en cœur les deux concernés, qui échangèrent ensuite un clin d’œil.-Et encore, continua le tenancier de l’établissement qui ne s’était aperçu de rien, vous, à la limite, seigneur Karadoc, pas besoin : vous avez une femme !-Ouais et parfois, c’est pas un cadeau, grommela-t-il dans sa barbe.-Mais au moins, vous n’êtes pas seul ! insista l’aubergiste. J’ose même pas imaginer ce que ça doit être pour les seigneurs s Bohort, Lancelot ou Perceval…-Bohort il a une femme ! lança bravement le Gallois.-Bohort il a une femme ? Vous pouvez me la redire sans trembler des genoux, celle-là ? railla leur interlocuteur.-Ben j’veux dire, on la voit jamais, mais ça veut rien dire…-En plus il a des mômes, renchérit Karadoc qui s’y connaissait, niveau marmaille. Des fois ils jouent avec les miens.-Et pis le seigneur Lancelot, moi j’pense qu’il en pince pour la Reine.-Bon bah vous, alors ! reprit le Tavernier en s’adressant à Perceval, cette fois. Comment vous faites, sans compagne ? Ça doit pas être évident, non ?-…Angharad m’aime bien… hésita le chevalier.-Ho-ho-ho ! s’enthousiasma l’aubergiste. Ça fait longtemps ? Vous êtes fiancés ?-Non, répondit-il honnêtement. Mais on a eu un dîner, une fois.-Ah, merveilleux, et d’oncques ?-J’lui ai dit que je savais pas ce qu’était une idylle, après elle s’est levée et elle a pleuré un peu.-C’est pour çaaaaa que vous étiez triste ! réalisa brutalement Karadoc.-Ouais. Mais je dis pas. »

*

En dépiautant la mie d’un morceau de pain, Arthur tenta de lui expliquer.

« Une idylle, ça veut dire ‘une jolie histoire d’amour’. Enfin en fait, au début, ça voulait dire un poème bucolique, mais pas besoin de retenir, ça.-Comme Virgile ? releva Perceval.-Comme… Oui, comme Virgile. Mais attendez, vous l’avez lu ? » Devant le ‘non’ de la tête du chevalier, il compléta : « Ah oui, c’est vrai, vous savez pas lire.-Donc Angharad, elle veut dire qu’on vit un poème ? J’suis perdu, là, Sire…-Non, elle veut dire que ce que vous vivez, c’est beau comme un poème.-Aïe, grimaça le jeune homme.-Quoi ?-Ben je lui ai dit que je connaissais pas ce mot-là.-Oh, c’est pas grave, ça… Vous avouez votre ignorance, y a de la franchise là-dedans, de l’honnêteté ; ptêtre qu’elle aime bien. Qu’est-ce qui s’est passé après ?-Ben là elle avait l’air fâchée…-Essayez de rattraper le coup, allez, ça va bien se passer. »

Devant la mine déconfite de son vassal, Arthur ajouta :

« De toute façon, ça fait huit ans qu’elle poireaute, à mon avis maintenant elle est habituée ! »",candidate00008
". Athéna, elle, ne bouge pas d’un iota, même si cette proximité physique lui hérisse un peu le poil. Soit l’autre n’a aucun sens de l’espace personnel, soit elle le fait carrément exprès. Connaissant la fourbe, ce serait plutôt la seconde solution… Méfiance, donc.

« C’est très coquettement aménagé, chez toi », la félicite la belle, en admirant la chambre spartiate. 

Dans le genre compliments, on ne peut pas dire que ce soit particulièrement bien trouvé. La pièce pourrait être inoccupée que cela en reviendrait au même. Malgré la bibliothèque remplie, pas de joyeux désordre d’adolescent comme dans les chambres de ses fils Éros, Antéros ou Peitho. Seuls le métier à tisser et la coupe remplie d’olives témoignent d’une présence ici. Ah, si : en observant attentivement, on trouve une lance appuyée dans un coin, ainsi que des épées et un casque d’or soigneusement rangés dans un autre ; tiens, pas d’égide ? Elle hésite à lui demander où le bouclier se trouve, avant de se rendre compte qu’en fait, elle s’en fiche. 

« Merci de la flatterie, répond la guerrière entre ses dents. En vrai, je sais pertinemment que rien ne t’intéresse chez moi. Tu peux partir, maintenant ? Tu m’empêches de lire…-Ma chérie, il y a bien plus intéressant dans la vie que la lecture… Et c’est faux de penser que rien ne trouve attrait à mes yeux, ici ! » 

Il est temps de passer à l’action. L’anadyomène se presse contre sa proie et laisse l’une de ses mains se nouer autour de sa taille. D’abord, elle se contente de la contempler tendrement, le regard d’or contre le regard pers. La vierge aux yeux brillants se trouble déjà et rougit un peu. Parfait. Passons à l’étape suivante.

Aphrodite pose sa jolie tête sur l’épaule de sa compagne, qui s’en retrouve trop déconcertée pour réagir. Sans doute les attitudes à adopter défilent-elles dans son esprit de stratège, comme autant de plans de bataille à suivre ? Seulement, ce combat-là, la déité du désir compte bien la remporter. L’enjeu est double : non seulement une victoire contre Arès, mais aussi contre cette déesse qui l’a toujours défiée.

Elles restent quelques instants dans cette position ambiguë, puis la main libre de l’hétaïre se glisse lentement sous le tissu qui couvre l’épaule de sa pudique voisine. Cette fois-ci, la déesse avisée la repousse vivement, le regard brillant de colère.

« Ça va pas ? Je suis une déesse vierge ! fulmine-t-elle à l’intrigante tombée par terre. Mais je suppose que toi, tu ignores le sens de ce mot ?... -J’ai jamais compris pourquoi on te considère comme vierge, alors que personne n’ignore ce qui se passait avec Pallas, persifle la déesse de l’amour.-Cela ne te regarde pas, il me semble, rétorque Athéna, hautaine.-Oh, mais si ! se réjouit-elle. Tout ça, c’est mon domaine, tu le sais bien… »

Elle se redresse, s’installe à nouveau sur le lit puis s’immisce encore à ses côtés, tel un serpent lascif. La combattante pense à la chasser, puis se rappelle qu’elle déteste toute violence inutile. Ceci dit, si jamais cette petite colombe niaise essaye encore quelque chose, elle ne répond plus de rien. 

« D’ailleurs, c’est vrai que tu n’as connu personne, depuis cette… nymphette ? » demande-t-elle de manière impromptue. Le dernier mot est prononcé comme s’il était obscène. « Ce ne sont pas tes affaires, gronde la guerrière. Et la naïade Pallas était ma meilleure amie. -Ça, c’est ce que tu veux bien nous faire croire, nuance l’autre Olympienne. Je ne suis pas dupe, très chère.-Veux-tu bien cesser ? » 

La fureur de la flamboyante guerrière aurait fait reculer n’importe qui – n’importe qui, certes, mais pas Aphrodite, si tenace.

« Ma pauvre petite déesse vierge, la plaint-elle. Au moins, ta sœur Artémis s’amuse bien, avec ses compagnes. Alors que toi, tu es toute seule. Oh, tellement seule… »

Une fois de plus, ses mains s’égarent sous la tunique légère. Athéna s’emporte. Personne n’a le droit de la toucher de cette façon.

-Lâche-moi ! rugit-elle en rejetant une fois de plus sa provocante tentatrice. Je n’ai pas besoin de toi.-Que tu penses, lui assène Aphrodite. Pourtant, ton corps m’assure du contraire. »

Ses mains tracent un sillage voluptueux sous le sage péplos. Sa victime tente à nouveau de se dérober, mais elle la rive sur place d’un baiser langoureux. Qui se termine par une morsure.

« Aïe ! geint la tentatrice.-Ça t’apprendra », en conclut la déesse martiale.",candidate00008
"« Je sais pas c’que c’est. C’est dangereux ?
-Ça peut vite le devenir, répondit Arthur avec humour, mais surtout pour vous.
-Je pige pas, là. »

D’un ton à la fois didactique et gentil, le roi reprit :

« Vous vous souvenez quand je vous avais expliqué que j’aimais bien manger avec vous, mais que systématiquement, au bout de dix minutes, j’avais envie de vous éclater la tronche avec le rebord de la carafe d’eau tellement vous me preniez la tête ? »

Le visage du chevalier s’éclaira.

« Ah oui, ça j’m’en rappelle bien ! Vous m’aviez dit que vous m’aimiez, aussi, ce jour-là, je me souviens !
-Oui, euh, voilà, approuva Arthur, un peu gêné. Ben c’est ça, le couac. On comprend rien quand vous causez, ni moi, ni les autres – même quand on vous aime, hein, attention. Ça commence à devenir un handicap, là. Sauf que les enchanteurs de Kaamelott ont apparemment trouvé un truc pour que ça aille mieux.
-Pourtant vous aviez fini par comprendre l’histoire des Graals… euh, de la grêle, fit Perceval d’une minuscule voix de gamin.
-Mais ou ça, ou autre chose ! C’est soixante conneries par jour ! Moi j’en ai marre ! Et les autres aussi, d’ailleurs ! »

Il se radoucit en voyant que son chevalier préféré était presque au bord des larmes.

« Hé, hé, du calme ! Vous allez pas pleurer, quand même, dites ? s’inquiéta-t-il en lui tapotant l’épaule.
-J’pleure pas, protesta Perceval d’une mine déterminée bien que fragile – il avait néanmoins le regard humide, émotif. C’est quoi, le machin de Merlin ?
-Une potion de clairvoyance.
-J’espère que c’est pas trop magique, quand même. La magie, ça me fout les miquettes.
-Ben… C’est une potion, quoi, expliqua platement Arthur. Comme celle que vous aviez prise pour pisser bleu, ou pour avoir une voix débile.
-Si c’est juste une potion, ça va », décida le chevalier, avec résolution.

Le roi effectua son geste coutumier de l’index pour demander le silence ou de la patience, fouilla dans la poche intérieure de son pourpoint, et en tira une petite fiole. Un liquide d’un bleuté serein, qui pétillant mystérieusement, s’entrechoquait à l’intérieur.

« Tenez, déclara-t-il d’un ton cérémonieux.
-J’en fais quoi ? » l’interrogea le jeune homme, tout perdu.

Il tenait le flacon dans ses mains en coupe comme si c’était extrêmement précieux. Un Graal miniature, songea brusquement Arthur. Pour chasser cette impression d’étrangeté, il revint à sa brusquerie coutumière.

« À votre avis ? Vous le buvez, imbécile ! »

Avec un courage enfantin, Perceval déboucha la fiole et l’avala d’un trait, en penchant brusquement la tête en arrière. Lorsqu’il releva les yeux, ils brillaient d’un éclat inhabituel.

« Tout va bien ? s’inquiéta le roi.
-Parfaitement, Sire », répondit le chevalier avec une assurance qui ne lui ressemblait pas.

Ce n’était pas son ton ordinaire, qui sonnait d’une manière à la fois bonhomme et simple ; plutôt une affirmation péremptoire, qui pouvait faire penser à Lancelot, à Galessin ou même au roi Loth. Le souverain se retrouva instantanément mal à l’aise.

« Comment vous vous sentez ? demanda-t-il encore – pour être sûr.
-Voulez-vous que je qualifie mon ressenti physique ou psychologique ?
-Tiens ! nota Arthur. C’est bien la première fois que vous vous servez de ce mot correctement !
-En effet, admit le jeune homme, sans la moindre once de modestie. C’est parce que maintenant, il m’est aisé de parvenir à déterminer la véritable signification de ce terme. Je me rends également compte qu’en réalité, je le confondais avec les mots ‘rural’ ou ‘agricole’. Difficile de comprendre exactement pourquoi le glissement de valence a eu lieu ; mais on peut supposer que j’aie réalisé une déconstruction anagramme. En temps normal, je souffre probablement de dyslexie phonologique, ce qui explique le caractère nébuleux et arbitraire de la composition de mes énoncés.
-Euh… D’accord…, admit le souverain, aussi perdu que l’était d’ordinaire son chevalier pendant leurs conversations. Venez, la réunion de la Table Ronde, c’est maintenant. Voyons un peu ce que deviennent vos rapports de mission, dans ces conditions !
-Ce sera avec plaisir, Sire », répliqua Perceval avec l’ombre de son sourire habituel.

Mais les yeux bleus restaient froids, éclairés d’une intelligence acérée, perturbante.

Sans le vouloir, Arthur frissonna.

 

*

 

« C’est le tour du compte-rendu de mission du seigneur Perceval, déclara Père Blaise.
-Oh",candidate00008
"sourient, complices, rendus solidaires par une destinée particulièrement éprouvante. Peu à peu, l’île cesse de tanguer, s’accroche au fond de la mer. Délos devient leur sanctuaire.

Mais elle n’est pas habitable pour des enfants aussi jeunes, même divins. Malnutri, le lait maternel se raréfie, menace de se tarir. Il est temps de partir. La déesse-mère revient en Lycie, sa terre natale, et y emporte ses deux petits, telle une mère louve.

Elle va chercher de l’aide auprès d’un allié, le fleuve Xanthe, que les mortels nomment ‘Scamandre’. Épuisée par son long voyage, Léto entreprend d’y laver les petits enfants. Des paysans, probablement mandatés par Héra, tentent de l’en empêcher ; ils déchaînent leur haine de l’inconnu, leur crachent dessus. Alors elle se met en colère, et lance une meute de loups enragés à leurs trousses.

Ce souvenir laisse une forte impression au tout jeune Apollon : les dieux ont toujours raison, et bien fol est le mortel qui s’oppose à eux. Il lui laisse aussi une profonde affection pour les loups – il aime à passer la main dans leur pelage –, tandis qu’Artémis, elle, en retient la force brutale de la nature, que nul ne peut entraver.

***

Très vite, Apollon devient un garçon habile au maniement de l’arc. Il ramène des oiseaux et du gibier d’eau à sa mère, tandis que sa jumelle s’occupe des autres proies : biches, cerfs, sangliers. Très vite, il comprend cependant que cela ne lui convient pas, et décide de vaquer à l’aventure, en dépit des inquiétudes de Léto. Alors son aînée part aussi ; elle dit qu’elle veillera sur lui – et ne manquera jamais à sa parole.

Ils errent de par les terres désolées, les montagnes escarpées, les sauvages forêts. Il ne peut trouver sa place dans ces lieux vides de toute présence humaine, tandis qu’au contraire, sa jumelle s’épanouit en ces espaces immenses qui parlent à son cœur, court avec les nymphes sylvestres, chasse en leur compagnie, se baigne dans les cascades pures avec elles. 

Le frère s’attarde près de la grotte du serpent Python, qui a jadis tourmenté sa mère, il s’en rappelle. Après un combat acharné, il vainc le monstre, pose le pied sur sa dépouille, et fait de cette ancienne tanière une montagne sacrée. Quant à sa sœur, elle préfère les mystères d’Éleusis, ou alors le lac Stymphale, mais ne se fixe jamais vraiment.

Aucun dieu ne se ressemble jamais, même si ceux de la seconde génération sont tous frères et sœurs ; mais il est particulièrement difficile de croire qu’Artémis et lui sont des jumeaux. Cheveux bruns emmêlés par le vent contre boucles blondes soignées et parfumées, peau hâlée par le plein air opposée à l’albâtre raffinée qui le fait ressembler à ses statues, cris du chaos de la chasse divergents de l’harmonie musicale.

Quelque chose dans le regard, peut-être, de terrible et d’impitoyable, qui se retrouve aussi bien dans les yeux de ciel d’été cerclés de noir, que dans ceux aux couleurs de la forêt – vert mousse, marron végétal, touches d’or automnal. Mais toutes les déités ont cet aspect imposant. Peut-être qu’elles, elles savent simplement mieux le cacher que ces deux-là.

***

Quiconque provoquera leur courroux le regrettera amèrement. En témoignent les amères larmes de l’orgueilleuse Niobé, désespérée à la perte de sa progéniture ; le prouve aussi le châtiment mérité de Tityos. Ils travaillent ensemble, même s’ils ne se ressemblent.

Sa jumelle, c’est un chat sauvage, toujours sur la défensive ou le qui-vive, les genoux écorchés et salis de terre, les coudes secs, le regard fuyant et un peu fiévreux. Ses ongles incrustés de sang, son chignon défait. Petite, Léto lui faisait des tresses, comme aux petites Athéniennes, et peignait aussi la longue chevelure de son fils ; maintenant, l’éternelle adolescente est une mal-peignée.

Parfois, en revanche, le dieu solaire laisse encore sa mère s’occuper de lui, le cœur gonflé de fierté. « Vous savez, Mère, vous venez vivre ici quand vous voulez. » Mais pour le moment, Léto préfère rester dans l’ombre, même si elle les soutient quoi qu’il arrive. Et pour Artémis, ce n’est pas tant qu’elle n’aime pas briller ; plutôt que les ténèbres lui conviennent mieux, la mettent davantage en valeur.

Cependant, autant que la lune aux multiples facettes, elle détient également un visage plus doux. Lorsqu’elle est particulièrement satisfaite de sa chasse, alors elle va rendre visite à son frère en son temple de Delphes, pose là ses armes, et mène la gracieuse danse des muses. Elle ne se soucie pas de faire tomber la bretelle de son chiton, de dévoiler la chair de ses genoux.

Ce serait mentir, de la part d’Apollon, que de prétendre que nulle concupiscence ne s’est jamais éveillée en",candidate00008
