"Véra n'entendait que le vrombissement des machines. Les yeux bandés, elle sourit en attendant impatiemment la suite des événements. Si on lui avait dit il a quelques années qu'elle s'adonnerait à ce genre de fantaisie sur son propre lieu travail, elle n'y aurait pas cru et pourtant elle était bien là. Une main gantée et puissante lui fit lever les bras en l'air et les adossa contre l'un des tuyaux au-dessus d'elle. 

-Prouvez-moi que vous n'êtes pas aussi ''vanilla'' que je le crois Véra. Murmura une voix basse et féminine. 

Cette voix eut vite fait d'éveiller en elle mille sensations. Elle ressentit d'abord une légère crainte qui ne dura que quelques secondes pour laisser place à l'excitation. Cette main vêtue de cuir noir se posa sensuellement contre sa gorge en la caressant de manière possessive avant de descendre lentement vers les boutons de son veston. L'un après l'autre, elle les dégrafa. La respiration de la directrice s’accéléra. Jamais elle ne s'était sentie aussi excitée. Quel délicieux et dangereux interdit! Ferguson était bien là derrière elle, s'amusant à frotter son bassin langoureusement contre les fesses de la directrice qui se sentit vite vaciller.

-Que dois-je faire pour vous le prouver? Gémit Véra qui sentie une forte pulsation entre ses jambes. 

Cet élancement ne fit que tremper ses sous-vêtements d'avantage. Ces mains élégantes et fougueuses qui la possédaient, caressèrent et massèrent sensuellement sa poitrine. La directrice gémit et sentit vite ses mamelons se durcir au contact des doigts experts de Ferguson. La bouche sensuelle de son amante se pressa contre son cou avant de se pencher à son oreille.

-Appréciez ce que je vous offre. C'est tout ce que j'exige de vous Véra. Murmura la voix chaleureuse de l'ancienne directrice.

Ce qu'elle se permettait de vivre était si mal et pourtant si bon, mais sa notion du bien et du mal se noya vite dans le fleuve de son envie. Joan agrippa le chignon de la femme et l'attira vers elle dans le but d'exposer son cou afin de permettre à sa langue qui s'y frayer un chemin avant de le mordiller. Véra les bras docilement en l'air, ne pu contrôler les gémissement qui émanait d'elle au grand plaisir de son amante qui de son autre main descendit la fermeture éclair de sa jupe. Lentement, très lentement, elle releva sa jupe afin de masser avec ardeur le devant de ses cuisses. La texture du cuir contre sa peau était agréable et brusque tout à la fois. C'est alors que la main de son amante se dirigea dangereusement vers son entre-jambe.

-C'est ce que vous souhaitez Véra? Murmura Joan à son oreille. 

La directrice était si excitée qu'elle sentie ses jambes devenir molles. Rester debout sur ses talons hauts devint soudainement très difficile. Son sexe était si sensible. Sentir les doigts de Ferguson s'y déposer était tout ce donc elle avait envie. 

-Oui! Faites-le! S'exclama-t-elle en se tortillant d'impatience.

Joan ricana et laissa glisser sa main sous la jupe et sous le sous-vêtement de la dame qui sursauta à son contact. Elle effleura cruellement son clitoris du bout des doigts tout en la mordillant au cou. Véra avait les jambes si molles qu'elle se laissa choir contre la poitrine de Ferguson qui maintenue la petite femme d'un bras sans cesser ses cruelles caresses de son autre main. La jeune femme était folle de désir. C'est alors que les doigts de Joan se pressèrent plus fortement contre sa petite chair rose et qu'elle les fit tournoyer rapidement contre celle-ci. Le souffle de Joan à son oreille ne fit que décupler son envie. C'est alors qu'elle atteignit le point de non retour et qu'elle jouit comme elle ne l'avait jamais fait. Encore tremblotante, elle ne put attendre plus longtemps, elle retira vite son bandeau et se retourna pour apercevoir une toute autre personne que la sombre amante qu'elle s'était imaginée. 

-Jake! S'exclama Véra étonnée.

-Bien sur qui voulais-tu que ce soit. Dit-il en riant. 

-Hum...non personne. Dit-elle en regardant au sol.

 

FIN",candidate00005
"sac et la fit glisser de son épaule et le déposa au sol. En ce moment, La jeune nomade oublia vite qu'elle possédait un sac. Elle ne pouvait détourner ses yeux de cette créature sage et magnifique. La dame entoura doucement Zoey de ses bras et la serra contre elle. La jeune fille imita rapidement sa partenaire et savoura cette douce étreinte.  Les lèvres charnues de la femme mûre se déposèrent sur l'épaule de la jeune fille qui inspira profondément avant d'expirer . La jolie Danoise lui pris la main et lui fit quitter le balcon afin de retourner à la chambre. 

-Contrairement à certains couples, ce n'est pas parce que nous doutons de notre union que nous nous permettons de faire ce que l'on fait, mais bien parce que nous savons que nous sommes un couple solide et que nous pouvons jouir de tous les plaisirs sans douter un seul instant de notre amour. Moi et Hanne sommes sur la même longueur d'onde et ça depuis toujours. Aucun n'a fait de pression sur l'autre. Nous sommes tous les deux ici et heureux de l'être. Dit Mads en servant deux coupes de mousseux aux femmes avant de s'en servir une lui aussi. 

Mads et Hanne avaient su lui dire ce qu'elle avait besoin d'entendre afin de se sentir en paix avec la situation. Par contre, elle ne pu s'empêcher de retourner sur le balcon pour s'emparer de son sac à dos avant de le reposer à l'intérieur.  Le couple la regarda amusé.

-Désolée, toute ma vie est là-dedans vous comprenez.  Dit la jeune fille en terminant sa coupe. 

-Je ne pourrais pas faire ce que tu fais. Ça demande du courage de faire ça. Dit Hanne en resservant la jeune fille à nouveau.

-Et un bon brin de folie. Ajouta Mads en riant tout en prenant une gorgée de cette boisson pétillante qui était  loin d’être sa préférée. 

Zoey ne répondit pas et c'est alors que la chanson ‘’Angel ‘’de Massive Attack se mit alors à jouer. Sa chanson. Elle oublia alors la présence du couple et se mis à danser langoureusement sa coupe toujours en main.  Hanne et Mads se rapprochèrent l’un de l’autre et se caressèrent la main en observant la jeune femme bouger élégamment et sensuellement devant eux. Après quelques instants Mads ne pu s'empêcher de s'exclamer.

-J'en était certain, je l'aurais parié. Dit-il d'une voix nouée par l’excitation.

 Voir le bassin et le corps athlétique de la jeune femme bouger de la sorte avait éveillé ses sens.

Zoey revint sur terre et réalisa qu'elle s'était évadée dans son monde sans en avoir le contrôle. Ce qui lui prouvait bien qu'elle était suffisamment à l'aise auprès d'eux pour se permettre d'avoir l'air aussi ''space'' et spontanée. 

-Certain de quoi? Demanda la jeune fille en prenant une gorgée.

-Je t’ai observé marcher lorsque tu servais aux tables et lors de ta pause.  Ton maintient m'avait mis la puce à l'oreille, mais après ce que je viens de voir...tu as dansé par le passé n'est-ce pas? 

La jeune fille termina son verre et décida de déposer sa coupe. Elle ne voulait pas être ivre morte. Les moindres souvenirs de cette nuit se devaient d’être aussi clairs que de l’eau de roche. Nulle envie de s’embrumer l’esprit.  Le rouge lui vint alors aux joues. 

-Oui je...j'ai dansé dans mon Pays. Pendant plusieurs années. Jusqu'à ce que le physique et la discipline ne me suive plus. À vrai dire, j'ai quitté ma troupe il y a seulement 2 ans de ça. 

-Est-ce depuis ce temps que tu mènes cette vie de bohème? Demanda Hanne. 

Zoey hocha la tête positivement.  Elle sentie rapidement la mélancolie l'envahir. Une artiste reste une artiste. Il est difficile de faire un autre métier ou de s'orienter vers un domaine plus stable après avoir vécu de si créatives et de si passionnantes expériences.  Zoey avait effectivement perdue ses repères depuis la fin de sa carrière de danseuse. 

Mads perçu sa tristesse et décida d'y mettre vite fin. Il cala sa coupe et la déposa avant de s'avancer vers elle et de lui prendre la taille d'une main et la main de l'autre. Automatiquement, la jeune fille sourit et ils se mirent à danser. Au début éloigné et petit à petit tel deux danseurs le lien se forgea et ils se pressèrent l'un contre l'autre en suivant le rythme de chacun. Zoey trouvait ridicule de constater à quel point son corps tremblait. Elle prit alors une autre grande inspiration, expira et adossa finalement sa tête contre le torse de l'homme.  Hanne sourit et s'avança lentement avant de se placer derrière Zoey et de se presser contre elle. La jeune nomade ressentit alors un puissant sentiment de réconfort face à toute cette tendresse. 

Après quelques instants de ses frottements,",candidate00005
"mais qui ne peuvent se passer l'une de l'autre. Dit le monstre en s'approchant.

Winston quitta le lit comme si toute menace était désormais écartée...peut-être était-ce effectivement le cas, mais j'avais peur tout de même. Voir ce sosie s'avancer à quatre patte sur mon lit alors que j'étais paralysé, me donna la nausée.

-Le mal possède de fâcheuses tendances destructrices alors que le bien est de nature passive...l'un est condamné à être détruit. C'est certain. Dis-je en le regardant me chevaucher sans pouvoir rien y faire. 

Le monstre m'afficha un sourire malicieux.

-Les instincts primitifs du mal sont inévitables.T'en et aussi longtemps que ces énergies demeurent distinctes l'une de l'autre oui le bien souffrira...mais en les fusionnant tous les deux, nous obtenons un équilibre parfait. Dit le monstre qui pris à nouveau l'apparence d'Hannibal afin de m'embrasser avant de regagner mon propre visage à nouveau. 

-Mon ange est aussi mon démon? Parlons-nous de moi ou d'Hannibal? 

Le diable pressa ses mains griffues contre mon torse et je me sentis à nouveau m'enfoncer à l'intérieur de mon matelas. 

-Nous parlons d'un désir profondément ancré. Bien des gens ne veulent pas accepter le mal en eux.  Vous avez laissé le mal vous possédez la nuit dernière Will. Vous m'avez laissé vous posséder. Qu'avez-vous ressentit alors? Dit-il en laissant sa main se diriger vers mon entre-jambe et le caresser.

Il s'agissait de moi-même...c'était une vision si étrange que je ne pouvais pas expliquer ni comprendre la source de mon excitation. C'était tellement malsain. Mon corps fut recouvert de frissons à nouveau, mais des  frissons de plaisir cette fois.

-D'abord de la peur...ensuite...de la fascination suivit d'une passion que je n'avais jamais ressentit jusque là. La bestialité de ce mal m'a plu...j'avais une envie folle d'inverser les rôles. Ce n'est pas bien. Dis-je en baissant les yeux et la tête.

Pour exprimer ma honte j'avais le droit de bouger de toute évidence.

-Pourquoi? Qu'est- ce qui n'est pas bien. Dit-il en frottant son bassin contre le mien.

Je sursautai et fermai les yeux.

-Cette bestialité ne sert qu'à voiler notre humanité et nous pousse à faire des choses monstrueuses. Je vous en pris arrêtez. Ne puis-je m'empêcher de gémir.  

-Je suis incorrigible. Cette apparence vous aidera certainement. Et cette bestialité sachez qu'il n'y a pas de mal à l'utiliser si l'on sait s'en servir avec modération. Dit le diable qui avait pris l'apparence d'Hannibal à nouveau.

La chaleur de ce nouveau corps contre moi, mis mes sens dans tous leurs états. Ma peur s'était envolée en fumée et ma répulsion aussi. 

-J'ai peur de ne pas parvenir à doser cette brutalité de manière adéquate en permettant cette fusion entre le bien et le mal. Dis-je en déposant mes mains sur les hanches du docteur. 

Oui je pouvais de nouveau remuer les bras et encore une fois pour parvenir à toucher Hannibal, mais je figeai rapidement. Dès que mes mains effleurèrent sa peau, il se transforma de nouveau en moi. Je reculai mes mains. Il me pris les poignets brusquement et plaqua mes bras contre mon oreiller. 

-Il faudra bien fusionner un jour toi et moi si non, je ne cesserai jamais de te hanter. 

Avoir peur de soi-même à ce point c'était impossible à croire.

-Si...si j'accepte. Comment fait-on pour fusionner. Demandais-je nerveux. 

Il considéra ma question comme une acceptation. Il se pencha alors sur moi et pressa ses lèvres sur les miennes et je sentis vite cette passion s'infiltrer dans tout mon être et l'homme vertueux me quitter.

Ensuite tout ce donc je me rappelle c'est d'une angoisse si forte que mon seul réflexe fut de me rendre chez Hannibal en pleine crise d'hystérie. Je frappai à la porte de toute mes forces. Hannibal vêtu d'une robe de chambre et les cheveux en bataille m'ouvrit rapidement et me fit entrer.

-Que se passe-t-il? Me demanda l'homme inquiet.

-Aidez-moi! C'était mieux lorsque je me fermais à lui. En m'ouvrant, je le laisse posséder non pas mon corps, mais mon esprit. C'est beaucoup plus grave! Vous devez le faire sortir! Criais-je en me frappant la tête. 

-Vous avez eu une visite de votre incube Will? Vous dites qu'il vous possède en cet instant même? 

-Je suis fou! Criais-je en le regardant.

Il observa mes yeux et sembla confus. Je me retournai vers l'un des miroirs au mur et vis cet horrible reflet rouge",candidate00005
"leur joie. Lisbeth ne put s'empêcher de sourire avant de réaliser que le portable qu'elle traquait en direct était en utilisation et que de la pornographie était regardé. Elle observa la table et Ole était là et buvait sa bière. Elle se leva et se dirigea en direction des toilettes pour homme et y entra rapidement. Elle prêta l'oreille et entendit tous les bruits qui pouvait lui rappeler un homme qui se masturbait. Elle quitta les toilettes rapidement et retourna à sa chaise. La personne qui sortie des commodités était Torsten. Un jeune adolescent en chaleur qui se branle devant tout et rien en cachette de ses parents, il n'y avait rien de significatif là-dedans...toutes ses pistes et ses soupçons s'écroulaient. Ole n'était pas le coupable elle n'arrivait pas à le croire.

-Merde! Meeeeerde!!!!!!!! Cria-t-elle en quittant le bar. 

Une fois à l'extérieur, elle cria à nouveau sa colère en s'asseyant sur le trottoir. 

Quelques minutes passèrent et Lucas quitta le bar avec Théo sous le bras. 

-Ce n'est pas ta journée toi. Je te ramène? Demanda l'homme gentiment.

-Non. Dit-elle en se relevant avant de s'écrouler contre le trottoir. 

Les deux pichets de bière et le coup qu'elle avait reçu au nez l'avait assommé plus qu'elle ne le croyait. Son front se heurta au sol et elle se cramponna la tête. 

-Ras-le-bol. Murmura-t-elle en touchant son front recouvert de sang. 

Elle sentit alors une main agripper son manteau de cuir et la relever avec force.

-Allez vient. Dit Lucas en utilisant son autre bras disponible pour lui maintenir la taille.

-Mon meilleur ami Lucas, c'est le meilleur. C'est superman. Il va nous ramener tous les deux à bon port et s'envoyer en l'air avec la belle Nadja ce soir! Dit Théo complètement saoul en regardant son ami avec admiration avant de jeter un regard absent à Lisbeth.

La jeune fille capitula et accepta la proposition d'être reconduit chez elle.

Lucas tout en roulant vers la maison de son meilleur ami observait les deux individus saoul dans son rétroviseur quelques secondes avant de reposer ses yeux sur la route. Il avait bu lui aussi ce n'était pas très sage de sa part de prendre le volant, mais il n'était pas dans un état d'ébriété aussi avancé que ses deux passagers. Théo fixait la jeune fille de la tête aux pieds, elle n'était définitivement pas son genre de femme. 

-Je paris que tu t'es tapé plus de filles que je ne m'en suis jamais tapé. Dit l'homme en la regardant toujours.

Lisbeth avait envie de lui dire que ça ne le regardait pas, mais décida de mettre son mauvais caractère de côté. Il lui avait attiré suffisamment d'ennui pour aujourd'hui. Elle décida plutôt de répliquer avec une pointe d'humour.

-Je ne sais pas combien de fille tu t'es tapé, mais je serais quand même prête à parier que oui.

Théo se mit à rigoler. Il ne la trouvait peut-être pas jolie, mais cette fille avait de la répartie pour deux et ça c'était amusant.

-Ça ne fait rien, car tu sais pourquoi? 

Lisbeth fait non de la tête.

-Car je suis très amoureux de ma femme. Je l'aime de touuuut mon cœur. 

Lisbeth ne put s'empêcher de sourire. 

-C'est une bonne chose, elle a rencontré un type bien. Dit la jeune fille en déposant sa main contre son nez afin de ne pas sentir l'haleine d'alcool de l'homme à ses côtés.

Lucas une fois devant la porte de son meilleur ami, fut accueillit par Agnès qui pris le relais. Elle jeta un coup d’œil derrière l'épaule de Lucas et le regarda terrifiée lorsqu'elle aperçue la jeune fille dans la voiture.

-Cette fille à un sérieux problème Lucas. C'est vrai qu'elle a cassé le nez de Kruger et tabassé Ole? 

-Les nouvelles vont vites. Oui c'est vrai. Ils étaient saouls et ils l'ont provoqué. Voilà le résultat. Enfin, prends soin de Théo. Dit-il en leur faisant au revoir. 

-Mon meilleur ami je t'aime! S'exclama l'homme tandis qu'Agnès ferma la porte en riant.

Lucas replaça ses cheveux et repris le volant avant d'arriver devant la seule petite maisonnette isolée du village. L'homme déposa le sac contenant le portable de la jeune fille sur son épaule et ouvrit la portière. Lisbeth s'était endormi. Elle faisait de petits bruits paniqués en fronçant les sourcils. Son rêve ne semblait pas plaisant. 

-Lisbeth...allez debout. J'ai besoin de tes clés. Lisbeth? 

Il déposa sa main sur son épaule et la remua afin de la réveiller. Elle sursauta en repoussant brusquement le bras de l'homme en regardant à gauche et à droite se demandant où elle était. 

-Wooo du",candidate00005
"Ferguson croisait celui de Véra, celle-ci l'évitait, elle qui pourtant avait tout fait pour entrer en contact avec la dame mûre. 

C'est alors que la directrice se leva rapidement et s'empara de deux petits verres givrés dans le réfrigérateur, les remplis de vodka et en tendit un à sa collègue. 

-En espérant que nos langues sauront se délier. Autrement, la situation ne sera que plus embarrassante. Dit Joan en donnant un petit coup à l'autre verre avant de l'engloutir rapidement. 

Véra observa le verre gelé entre ses doigts. 

-D'habitude je n'ai pas besoin de ça pour m'exprimer...depuis la mort de ma mère, j'ai appris à m'affirmer d'avantage. Dit-elle en avalant le fort produit qui échauffa son corps spontanément. Après avoir reposé le verre, elle enchaîna. 

-Je suis désolée...désolée de m'être emballée inutilement. Désolée d'avoir mal interprété la raison de ma présence chez vous hier soir. Ce petit dîner et...enfin vous étiez très...

-Qu'étais-je Véra? Coupa Ferguson.

Celle-ci voulu se lever pour resservir, mais Véra lui pris doucement le poignet pour l'arrêter. 

-Vous étiez très en beauté.

Ferguson peu habituée aux compliments évita son regard et continua son chemin vers la bouteille qu'elle ramena au salon. Véra mis sa main dans ses cheveux mal à l'aise. 

-Désolée je...je crois que je ne fais qu'empirer les choses en vous avouant tout ça. Ma crédibilité en prend un sacré coup. Dit-elle en se frottant le front. 

Ferguson l'observa comme si elle était une énigme à déchiffrer. Elle lui emplit son verre à nouveau ainsi que le tien qu'elle but rapidement sans ressentir énormément d'effet. Cette boisson, son corps et son esprit y était accoutumé depuis un moment déjà. 

-Comment parvenez-vous à exprimer ce que vous ressentez avec une telle facilité...sans craindre d'être blessée ou manipulée.

Véra bu rapidement son verre et le reposa. 

-Oh vous vous trompez. En ce moment je suis morte de peur. Ce que vous pouvez me répondre, ce qui peut suivre me fait peur...mais...mais dans mon métier, dans ma vie privée, bref dans toutes les sphères de ma vie, j'ai appris que je ne dois pas laisser la peur m'empêcher d'avancer et de poser les gestes qui me paraissent juste. Dit sagement la jeune femme malgré la détente soudaine que lui avait procuré l'alcool. 

Ferguson déboutonna son veston. Véra observa ses jolies mains élégantes dégrafer chacun des boutons et ne pu s'empêcher de sourire tristement. Joan remarqua sa façon de la regarder. En général, elle intimidait les gens et sa confiance en elle faisait reculer ceux qui l'entourait. Rares étaient les fois où elle se trouvait face au scénario inverse. Véra avait clairement envie de se rapprocher d'elle. 

-Alors l'alcool n'est pas responsable de...Dit Joan qui ne termina pas sa phrase et se servit plutôt un autre verre.

-L'alcool n'est pas responsable du baiser et des caresses que je vous ai donné hier soir. Dit Véra avant de rougir et de baisser la tête. 

Ferguson toucha son chignon de sa main droite nerveusement. La barrière intérieure qu'elle s'était construite depuis l'enfance était solide et n'avait pas l'intention de lui faciliter la tâche.

-Je...je ne sais pas quoi dire...et ça me fâche. 

-Cette colère est contre moi? Demanda Véra tristement. 

Ferguson mis sa main devant elle en signe de négation.

-Non...je...exprimer clairement mes émotions ne m'est pas facile et ça me fâche contre moi-même. 

-Si vous vous ouvrez, vous craignez d'être blessée et manipulée? 

-Probablement. Dit la dame mûre froidement. 

Véra était triste pour elle, mais souhaitait la mettre à l'aise. 

-Prenez tout votre temps pour me parler. Je ne suis pas pressée. Si vous tentiez de me dire comment vous vous êtes sentie hier soir. Trahie, insultée, dégoûtée...peut-être que je...

-Non! S'exclama Joan avec une telle assurance que Véra en resta bouche-bée. 

Joan tapota maladroitement la cuisse de Véra avant de retirer sa main. 

-J'ai...vos...vos lèvres et ...et vos mains sur moi. J'ai senti que je perdrais le contrôle voilà. Je ne l'ai pas supporté. 

Véra sentie son cœur battre la chamade.

-Vous...vous avez aimé? Osa-t-elle demander.

Le sujet devenait trop difficile à aborder pour Ferguson.

-Ce dîner Véra...était...se voulait amical. Je ne visais rien de plus.  

Véra déçue serra les lèvres et se versa un autre verre qu'elle but rapidement. Si vite que quelques gouttes tombèrent sur son menton. Joan instinctivement, approcha sa main et essuya lentement les gouttelettes de son pouce sans dédain ce qui ne lui ressemblait pas. Le regard des femmes se croisa et aucune d'entre",candidate00005
