"’un coup, et fit un pas en arrière. — Comme vous voudrez ! Mais ne vous en faites pas, je sais exactement quoi écrire pour le numéro de demain, monsieur… Koskinen. Elle prit un air pincé comme si on lui avait mis de la bouse de dragon sous le nez. Matti était habitué à cette réaction, mais ça ne l’empêchait pas d’en être furieux. — Peut-être qu’un vrai Suédois ferait un meilleur boulot, ajouta-t-elle en touche finale avant de lancer un regard méprisant à Matteus. Putain, ce qu’il détestait les journalistes ! Et les femmes plus grandes que lui. Foutu mètre soixante-quinze !

La nuit était tombée bien vite, comme elle en avait l’habitude à cette époque de l’année. Il n’était même pas trois heures et demie de l’après-midi que le ciel se parait déjà de sa palette crépusculaire. Magnus en avait enfin fini avec l’autopsie de la première victime, Hale Carsten, et se perdit un temps dans la contemplation des cieux qu’il s’imaginait rougeoyants. À travers les fenêtres du bureau des Aurors, ce n’était pas toujours facile, et… — Ah, Magnus ! Alors ? Sa sœur ne lui avait même pas accordé deux minutes pour souffler. Elle était adorable, mais qu’est-ce qu’elle pouvait être chiante aussi ! Il soupira bruyamment avant de se tourner vers elle. — Je n’ai pas encore fait mon rapport à Koskinen, alors je pense que tu peux attendre pour les potins. On a rendez-vous à quelle heure, déjà ? Déçue et frustrée, Birgit fronça les sourcils. — Cinq heures. T’as le temps de prendre une douche et de te changer, t’as une vraiment une tête de déterré. Sans mauvais jeu de mots ! — Bien sûr… Il ne put s’empêcher d’esquisser un sourire, et passa une main dans ses cheveux hirsutes. Elle avait beau être reloue, sa sœur avait raison. Il avait bien besoin de passer par la case salle de bains. — Dis, pour hier…, reprit-elle. — Laisse tomber, Birgit. Visiblement, il n’avait pas envie d’en parler. Ses relations avec son père et avec Regnus n’avaient jamais été bien brillantes, et ce n’était pas maintenant que ça allait s’arranger. Il avait beau faire tous les efforts qu’il voulait, ça ne servait à rien si le patriarche s’amusait à les saper. Pour aucune raison, d’ailleurs, si ce n’est la satisfaction de leur pourrir la vie. Tor Alexandersson n’avait jamais eu d’autre ambition, du moins c’était ce qu’il lui semblait. — Je te dois quand même des excuses, au nom de père. Alors là, c’était la meilleure ! Magnus arqua un sourcil, à moitié amusé par une telle réplique. — T’es sérieuse là ? T’es pas responsable de sa connerie, à ce que je sache. C’est lui qui nous doit un paquet d’excuses… Pas que ça règle le problème dans le fond mais bon. — T’es vraiment pas prêt à lui pardonner… — Non, tu crois !? C’est un connard. C’est pas parce que c’est mon père que ça change quelque chose à ça. C’est pas de moi qu’il aura des circonstances atténuantes, bien au contraire. Bon, t’as quelque chose de vraiment important à me dire ou…? Clairement vexée, Birgit secoua la tête et disparut de son champ de vision, aussi vite qu’elle était apparue. C’était pas possible, elle devait être montée sur ressorts pour être aussi vive et réactive, compte tenu des circonstances. Avec une grande inspiration, Magnus se décida enfin à aller frapper à la porte du bureau du chef des Aurors. — Ouais ! Il était là, assis derrière son bureau à regarder vaguement par la fenêtre. Ça semblait être l’activité préférée des sorciers à Björnhojden, en ce moment ! — J’ai terminé l’autopsie de Carsten, annonça simplement Magnus. Il avait cherché à ne pas trop élever la voix, mais qu’il le voulait ou non, ses intonations riches et graves résonnaient facilement. Tout le quartier général tomba dans un silence pesant, que Matteus brisa presque immédiatement. — Ferme la porte et vous ! Au travail ! L’Auror s’était adressé au reste de son équipe avec ce qu’il avait voulu être une voix forte, mais qui n’avait comme effet d’être encore plus aiguë que d’habitude. N’était pas un stentor qui le voulait. Magnus se tenait toujours debout devant lui, imperturbable. S’il trouvait la voix de Matti ridicule, au moins ne lui faisait-il pas savoir, et c’était déjà un changement rafraîchissant. En y réfléchissant bien, le médicomage légiste ne lui avait pas non plus fait remarquer sa taille un peu trop moyenne, ses dents mal foutues ou ses origines finlandaises. C’était quand même triste",candidate00001
"il trouva Sherlock bizarrement allongé sur le lit de l'hôtel. Mycroft avait cru de bon ton de leur réserver une chambre avec lit double. Sérieusement ?

« Alors ? » demanda-t-il.

« Quand vas-tu arrêter de poser cette question ? » Sherlock soupira. « Armande a été tuée, ça ne fait pas de doute. Je cherche d'autres cas similaires : de jeunes femmes qui se seraient pendues, en laissant une courte lettre de suicide bien mieux écrite que ce dont elles ont l'habitude. » 

« Ah, c'est pour ça que tu en profites pour procrastiner sur son blog Tumblr ? »

« Silence. Je ne procrastine pas, regarde-ça. »

Il tourna l'ordinateur pour que John puisse le voir. Un dessin d'une femme pendue s'étalait sur tout l'écran, avec un bureau à gauche, et un lit sur la droite. Exactement la même mise en scène. 

« On dirait une esquisse. » murmura John. 

« Exactement ! C'est un brouillon. Pour une photo. Peindre aurait été trop long pour la plupart des artistes, et de toute façon il n'y avait ni traces ni odeurs de peinture dans la pièce. Par contre, il y avait ça. » Sherlock montra le petit bout de caoutchouc. 

« C'est quoi ? » 

« Faut vraiment que j'explique tout : un cache. Le machin qu'on met sur les prises d'appareil, histoire qu'elles ne prennent pas la poussière. Celui-ci appartient sûrement à un appareil photo. Ou à une caméra, mais ça m'étonnerait. »

« Pourquoi ? »

« Filmer des pendaisons est ennuyeux. Ca ne bouge pas. Ca ne prend que quelques secondes, à moins que l'on ne se rompe pas le cou. Ce n'est pas comme si elle s'était ouvert les veines et vidée de son sang. Là, il y aurait eu quelque chose à filmer. Non, je suis quasiment sûr que l'on a affaire à un photographe. Voyons voir... »

Avant même que John ne puisse réfléchir à une réplique, Sherlock cliqua sur le pseudo de la personne qui avait bloggé le dessin. S'en suivit tout un tas de manipulations compliquées, jusqu'à ce que le détective accède enfin à l'adresse IP du mystérieux inconnu. Le nom de la rue indiquée rappelait quelque chose à John.

« Mais... »

« Oui, c'est juste à côté. Nous avons notre tueur, son adresse et son mode opératoire. »

« Et le mobile ? » 

« Oh John je t'en prie, une chose à la fois ! J'ai besoin de chocolat. » 

Blasé, le dit John s'allongea dans le lit, sautant dedans en espérant ennuyer Sherlock le plus possible. Ce dernier sembla vraiment déstabilisé. Il referma l'ordinateur de Armande Deliège, et le posa sans ménagement sur la table de chevet. 

« Je vais m'en chercher, puisque, apparemment, tu es au-dessus de tout ça... » 

La seule réponse de John fut un éclat de rire sarcastique. Il était fatigué, et il avait besoin de sommeil. Que le chocolat de Sherlock aille se faire foutre. 

5. 

Il n'était pas tard, du moins, pas assez pour trouver encore un Carrefour d'ouvert. Sherlock farfouilla dans les environs de l'hôtel jusqu'à en trouver un, et alla y faire son stock de tablettes pour la nuit. En sortant du bâtiment, la plaque de la rue l'interpella. 

« Tiens, tiens, ça me dit quelque chose... » 

Evidemment ! Il était à deux pas de l'adresse indiquée par l'IP du mystérieux suicideur de jeunes femmes ! Autant y faire un tour, non ? Croquant dans son chocolat noir à peine sorti de l'emballage, il s'engouffra dans la rue, la longeant jusqu'à trouver la bonne intersection. Il marcha quelques bonnes minutes avant de tomber sur l'adresse qu'il avait mémorisée. Cela dit, il y avait un petit problème. 

« Hmm, je vois. » 

C'était une résidence, comportant au moins cinq immeubles de huit ou dix étages. Même s'il avait réussi à isoler une adresse, cette dernière était moins précise qu'il ne l'aurait cru. Il aurait du vérifier sur Google maps avant de traverser la ville en croyant que c'était dans la poche, ça lui apprendra ! Enfin, ce n'était que partie remise. 

Trois quarts d'heure plus tard, il était de retour à l'hôtel. L'excitation en moins faisait qu'il avait marché plus lentement qu'à l'aller. Et aussi qu'il avait dévoré ce qu'il avait acheté sur la route. Tant pis pour lui. Il n'avait pas sa clé de chambre, mais il ne s'en faisait pas : John n'avait pas fermé derrière lui. Il poussa le panneau de bois sans difficulté, et le referma silencieusement. Son ami, en sous-vêtements et épuisé, était en train de dormir. Et",candidate00001
"4, en canon-divergence. La seule grosse incohérence c'est l'absence totale de mention du Desert Wolf, mais au fur et à mesure les autres personnages de la série vont faire leur apparition. C'était parti d'un OS en mode 'tiens c'est drôle' et je me retrouve avec une fanfic qui risque d'être assez longue et complexe. L'effet papillon.

J'espère que ce chapitre vous plaira !

 

Ça, c'était fait. Il s'était enfin décidé, après y avoir réfléchi pendant des jours et des jours. La situation était devenue clairement inconfortable pour tous les deux, et il se devait de faire quelque chose. Il avait simplement rompu. Les mots n'étaient pas venus facilement, mais quand le premier avait passé la barrière de ses lèvres, le reste était sorti naturellement, comme l'eau à travers la brèche d'un barrage. Stiles n'avait pas imaginé que cela pouvait lui procurer tel soulagement. Un poids avait disparu de son coeur. Il en avait fini de se mentir.

Le téléphone sonna dans le vide pendant quelques secondes, avant que quelqu'un ne décroche enfin.

— Derek ?

— Ouais ?

— Euh… T'es chez toi, là ?

— Oui. Tu peux venir si tu veux.

— Ouais, j'ai quelque chose à te dire…

La conversation ne se prolongea pourtant pas. Ils n'avaient pas besoin d'en parler avant d'en parler en face à face. En réalité, ils en avaient déjà parlé. La vie était parfois compliquée, et il fallait parfois savoir être radical pour la rendre plus simple. Derek et Stiles en avaient longuement débattu : devaient-ils tuer leur relation dans l'œuf ou annoncer à leurs petites-amies respectives que c'était fini ? Tous deux avaient de vrais sentiments, Stiles pour Malia et Derek pour Braeden mais ces sentiments ne faisaient pas le poids face à ce qu'ils ressentaient l'un pour l'autre. Ce qu'ils avaient toujours ressenti, maintenant qu'ils se penchaient sur la question.

— Alors tu l'as fait ?

Derek n'était pas le genre de mec à tourner autour du pot. Il y avait des moments où ça énervait Stiles, mais pas ce soir là. Le garçon acquiesça seulement, et entra dans le loft.

— Comment elle a réagi ?

— Pas très bien, répondit le jeune homme, soupirant bruyamment alors qu'ils s'asseyaient dans le canapé. Il fallait s'y attendre, non ?

— Elle a ses humeurs et un sale caractère, mais elle finira par s'y faire. Ne culpabilise pas de l'avoir blessée.

— Si, je culpabilise. Et je l'ai vraiment blessée. Ok, elle est vraiment chiante parfois mais c'est une fille bien dans le fond et je peux pas m'empêcher de me sentir comme une merde en pensant à ce que j'ai fait.

Derek passa un bras rassurant autour des épaules de Stiles, se rapprochant de lui au passage.

— Tu lui as dit pourquoi ?

— Pas vraiment. Elle a gueulé que s'il y avait une autre fille, elle finirait par le savoir. J'ai dit qu'il n'y en avait pas. Et je ne mentais pas, hein… Pas d'autre fille…?

Il avait l'air dévasté, sur le point de pleurer.

— Et elle a pleuré, continua-t-il. Et je ne savais plus quoi faire ou dire.

Stiles luttait contre ses sanglots lorsqu'il sentit les lèvres de Derek se poser sur son front. La tendresse inattendue du loup-garou était si émouvante qu'il laissa échapper une unique larme. Il se frotta immédiatement la joue, ne voulant pas paraître trop sensible.

— Tu as le droit de pleurer, murmura Derek dans le creux de son oreille. Pour elle, et pour toi.

Il le serra dans ses bras, lui caressant doucement le dos et les cheveux. Qui aurait cru qu'un loup aussi badass fût capable de la plus infinie tendresse ? Merde, Stiles était tombé amoureux du plus grand chaton que la terre ait jamais porté.

— Et toi ? demanda-t-il entre deux sanglots.

— Quoi ?

— Est-ce qu… que t'as rompu ?

— Oh. On n'était pas vraiment ensemble de toute façon. Je lui ai juste dit que la fête était finie. Elle a compris.

Braeden n'était pas idiote, ça ne faisait aucun doute. Derek était convaincu qu'elle pensait qu'il s'était casé des jours avant qu'il ne le lui annonce officiellement. Cela dit, comprendre ne voulait pas dire ne rien ressentir. Derek n'avait simplement aucune idée des sentiments de Braeden. Cette femme était bien plus mystérieuse que lui ne le sera jamais, et c'était pour cette raison qu'il l'appréciait autant.

Le silence tomba, brisé seulement par les soupirs d'un Stiles essayant d'arrêter de pleurer. L'embrassant sur la joue avant d'atteindre ses lèvres, Derek glissa ses",candidate00001
"qui allait tout revomir ensuite, Varus serra Amumu dans ses bras. C'était leur petit rituel. Varus détestait le contact avec les autres, mais il sentait qu'Amumu en avait besoin. Et franchement, avec lui, ça ne le dérangeait pas. Les autres se contentèrent d'une main vaguement levée, et au mieux d'un poignée de main, comme il le fit avec Annie et Fizz.

« Alors, qu'est-ce que j'ai loupé ? » demanda-t-il, alors qu'il finit de ranger ses affaires.

« Que dalle. » répondit Morgana.

Et ils marchèrent en silence jusqu'au réfectoire.

 

Lorsqu'ils ouvrirent les portes, le bruit leur explosa au visage. Tout le monde mangeait et parlait avec un entrain malsain. Autant de joie de vivre et d'insouciance, ça donnait des envies de meurtre à Varus. Autant de personnes qui se foutaient bien de savoir s'il était vivant ou mort. Des personnes qui ignoraient la couleur que pouvait avoir la tombe d'un père ou d'une mère. Des personnes qui osaient encore penser que la vie était belle. Cette naïveté obscène lui donnait mal à la tête. Et envie de vomir.

« J'ai pas faim, en fait. » finit-il par murmurer, avant de s'éclipser.

Il disparut au coin d'un couloir avant même que Morgana ou Amumu n'aient l'occasion de le suivre, et s'engouffra dans les toilettes. Il referma la porte, savourant le calme qui l'entourait de nouveau. Dans sa quête folle et claustrophile de quatre murs sombres au milieu desquels régnait le silence, il lui arrivait souvent de s'enfermer comme ça. Cela faisait longtemps que ses amis n'essayaient pas de le convaincre de sortir. Ca ne servait à rien. Et puis, qui étaient-ils pour lui faire la leçon ?

De longues minutes passèrent, au cours desquelles Varus ne pensa à rien. Quand on a un esprit qui pose beaucoup trop de questions, avoir du temps pour se vider le cerveau, ça devient vraiment essentiel. Et quand on ne l'a pas, on se le créé.

Puis, il se décida à sortir sa trousse. Pas celle avec les stylos, l'autre. Vlad avait dit qu'elle était plus pure... il allait vérifier à quel point.

 

C'était fascinant. L'aiguille qui entrait dans la chair, perçant la peau, glissant dans la veine... beaucoup pensaient que c'était douloureux, mais ce n'était pas vraiment le terme. Une aiguille ne fait pas mal si on est prête à l'accueillir. C'était un peu comme faire l'amour : si on est détendu, on n'en tire que du plaisir. Varus y songea, alors qu'il contemplait presque amoureusement les cicatrices sur son avant-bras gauche. Toutes ces entailles... il ne se souvenait pas de la douleur, juste du bien-être que ça lui avait procuré. Il savait aussi que d'une petite pression du pouce, il atteindrait le paradis.

Il se sentit glisser loin, très loin du monde. Engourdi et les yeux fixés sur le plafond, il esquissa un sourire. Elle était vraiment pure. Aussi pure que l'air que respiraient les anges.

Il n'arrivait pas à ouvrir les yeux. Combien de temps s'était écoulé ? Il ne se souvenait même plus de l'endroit où il était. Son corps ne répondait plus. Enfermé, pour de bon, à l'intérieur de lui-même. Il lutta pour entrouvrir les paupières, et encore plus pour bouger son index. La langueur oppressante et délicieuse s'effaça alors pour laisser place à une douleur lancinante, presque insoutenable dans la poitrine.

 

« Docteur Shen ! Docteur, je crois qu'il s'est réveillé ! »

La voix était lointaine, méconnaissable, sourde comme s'ils étaient au beau milieu de l'océan. Mais quelque part au fond de lui, Varus la connaissait. Il le savait. Son cerveau était trop grillé pour fonctionner et coller un nom à cette impression rassurante et familière. Mais il le connaissait.

« Il a bougé... Enfin il essaie. » continua la voix familière.

« Bien, on pourra le transférer demain matin. Vous feriez mieux d'aller vous reposer vous aussi... »

« Docteur je peux... ? »

Les voix s'éloignèrent, jusque dans le couloir il semblait, et Varus n'entendit plus rien. Plongé de nouveau dans un silence réparateur, il s'enfonça dans le sommeil.

Il ne se réveilla que le lendemain – ou du moins c'était son impression, le soleil était déjà haut dans le ciel – et fut à moitié surpris de se trouver dans une chambre d'hôpital. Tout était si blanc autour de lui que c'en était éblouissant. Il plissa les yeux et se tourna pour se mettre sur le ventre. Ou du moins, essaya-t-il. Sans le faire exprès, il avait tiré sur sa perfusion, et une vive douleur était remonté dans son bras. Dépité, il mit son autre",candidate00001
"sentait Kili haleter sous lui, ses mains se crisper sur les draps, son corps se raidir, s’abandonner totalement au plaisir, ses gémissements se faisant de plus en plus francs. 

« Fili… je… je ne… vais pas… tenir… » 

Les soupirs de Kili étaient à peine audibles, mais Fili avait déjà deviné ce qu’il voulait lui dire. Il se redressa, et revint l’embrasser pendant qu’il continuait de le caresser. Avec les mains, cette fois. Il ne suffit que de quelques minutes supplémentaires à Kili pour se libérer lui aussi, recroquevillé contre Fili, ses ongles profondément enfoncés dans son épaule. Ils restèrent ainsi un long moment, pantelants, reprenant leur respiration, et leurs esprits. Ca n’avait pas duré plus de quelques dizaines de minutes, mais ç’avait été si intense… C’était bien sûr la première fois que Fili faisait ce genre de choses, et il était plus que certain qu’il n’était pas un spécialiste, mais c’était aussi la première fois que ce genre de choses arrivait à Kili. 

Ils ne dirent rien. Pas à ce moment. Ils se contentèrent de rester serrés l’un contre l’autre, Fili pressant Kili contre sa poitrine. Et ils se rendormirent. 

 

Quand le matin arriva, ils restèrent longtemps muets, rendus silencieux et immobiles par leur gêne. Fili finit par se sortir du lit, complètement nu, ses braies s’étant échappé dans son sommeil. Ca ne semblait pourtant pas l’embarrasser plus que ça… Pas alors qu’il avait l’esprit plein des images des événements de la nuit. Ce qui était autrement effrayant et gênant, il fallait le remarquer. Il se dirigea pourtant vers la table, l’air de rien, tenant juste sa blessure au ventre qui tirait un peu. Et là, regardant Kili encore étendu dans le lit, il grignota un bout de pain. Il n’eut pas à attendre longtemps pour que ce dernier se réveille, et ne se mette à le regarder aussi. C’était comme s’ils se demandaient silencieusement ce qui avait bien pu se passer cette nuit, alors qu’ils le savaient parfaitement tous les deux. Ce fut l’aîné qui parla en premier, finalement, un air las peint sur le visage.

« On devrait oublier ça. » 

C’était la meilleure chose à faire, s’ils voulaient continuer comme ils l’avaient toujours fait. Il s’attendait à ce que son petit frère hoche docilement la tête, comme il le faisait d’habitude, mais ce dernier la secoua lentement, plongeant des yeux paniqués dans ceux de Fili. 

« …Non… » 

Rien n’aurait pu davantage surprendre le blond. Il écarquilla les yeux, et cessa de mâchonner. 

« Tu déconnes… ?! » 

Kili secoua la tête à nouveau, affichant toujours un air de chien battu. 

« Et Kona ? » 

Ce fut comme si on avait jeté une enclume sur Kili, tout d’un coup. Il détourna le regard, penaud, et finit par hausser les épaules. 

« …T’as avalé ta langue ? » 

Le ton badin sur lequel Fili avait posé cette question - des plus pertinentes, d’ailleurs - fit sourire Kili, qui se décida à se sortir du lit lui aussi. Il tenta de rattraper ses braies, et abandonna bien vite. De toute façon, son frère était déjà nu devant lui. Autant y aller franchement. C’est donc sans aucun vêtement qu’il apparut hors du lit, réveillant le désir de Fili. Cette fois, il se contrôla. Il le devait : ils n’avaient pas fini de parler.

« Alors, tu vas faire quoi ? » insista-t-il. 

« A ton avis… Il n’y a qu’une chose à faire… » répondit Kili, laconique. 

« Et… ? » continua Fili : il allait le dire, oui ou non ?

« Ben... J’ai pas trop le choix… » 

 

Dans la journée, Kili alla chez l’orfèvre. Il s’était décidé il y a quelques temps, et le regrettait un peu maintenant. Mais un cadeau restait un cadeau, peu importe les circonstances. Cet objet était lié à son destinataire depuis bien avant sa conception. Le moins que Kili pouvait faire, c’était de le lui remettre. Même si le message qui allait avec ne serait pas celui qu’on attendait. Délicatement enveloppé de cuir brun, il saisit l’objet et sortit de la boutique, cherchant des yeux Kona, à qui il avait donné rendez-vous. 

Elle était déjà là, assise sur un banc de pierre, près du parapet du premier pont. Elle était magnifique, avec ses longs cheveux roux et ses yeux verts mais en la voyant, Kili ne changea pas d’avis. Il soupira, s’avança vers elle, et la salua d’un geste de la main. Ils n’avaient jamais été beaucoup plus proches que pendant les quelques chastes câlins qu’ils s’étaient faits. Rien qu’en remarquant ça, le jeune nain sut qu’il n’était",candidate00001
